PuzzleId,FEN,Moves,Rating,RatingDeviation,Popularity,NbPlays,Themes,GameUrl,OpeningTags
00NaX,4r1k1/1p2r3/p1p5/3p1p2/PP1P1q1p/2Q1P1pP/5PP1/4R1K1 w - - 0 39,e3f4 e7e1 c3e1 e8e1,432,93,78,285,endgame kingsideAttack master mate mateIn2 queenRookEndgame short,https://lichess.org/rZL4HlNU#77,
00Nay,r2q1r2/ppp2pk1/3p1n2/4p1p1/2B1P3/2NP2Q1/PPP5/2K4R b - - 0 19,g7g6 g3h3 f8h8 h3f5 g6g7 f5g5,1850,75,95,6968,crushing deflection long middlegame quietMove,https://lichess.org/wMvkJfcA/black#38,
00Nej,6k1/1p3pp1/pB2qb1p/2P5/1P6/6QP/4r1P1/3R3K b - - 4 33,f6e5 d1d8 g8h7 g3d3 e6g6 d3e2,1072,88,91,3108,crushing endgame fork long,https://lichess.org/P5XLEtLV/black#66,
00Nf5,r1bq1rk1/pp2bppp/2pp1n2/8/5P2/5N2/PBPPB1PP/RN1Q1RK1 w - - 5 11,b1c3 d8b6 g1h1 b6b2 a1b1 b2a3,1423,74,95,11415,advantage fork long opening,https://lichess.org/JkE5qS7u#21,Polish_Opening Polish_Opening_Other_variations
00Ngg,3qk2r/1p1bbppp/4pn2/1BPp1n2/3P4/4PN2/5PPP/BN1QK2R w Kk - 1 15,d1e2 d8a5 a1c3 a5b5,1484,75,89,294,advantage fork middlegame short,https://lichess.org/5oeDyMdB#29,Polish_Opening Polish_Opening_Grigorian_Variation
00Nhl,5r1r/pR5p/k1ppb1n1/4p1Q1/N3P3/1P1P4/P1P3PP/6K1 w - - 1 23,b7h7 g6f4 g5f4 e5f4 h7h8 f8h8,2229,77,94,2278,advantage long middlegame,https://lichess.org/BEOTFmYh#45,
00NiV,rn2qrk1/ppp2N1p/3pPpB1/3n4/6b1/8/P1QN1PPP/R4RK1 b - - 0 18,h7g6 c2g6,850,80,100,435,kingsideAttack mate mateIn1 middlegame oneMove,https://lichess.org/NvBz7kYS/black#36,Italian_Game Italian_Game_Evans_Gambit
00Nih,8/3K4/8/5k1p/7P/8/8/8 w - - 1 62,d7e7 f5g4 e7e6 g4h4,1178,232,38,17,crushing endgame pawnEndgame short,https://lichess.org/uGsqUTBh#123,
00Nqd,8/p7/5P2/PP1bp3/4N3/K2p4/2k5/8 b - - 0 48,d3d2 e4d2 c2d2 b5b6 a7b6 a5b6,1618,76,98,792,crushing endgame long sacrifice,https://lichess.org/Mi2GPvfd/black#96,
00Ns0,r2qr1k1/pn1p2pp/bp3p2/2p1N3/2P5/1PB3Q1/P1P3PP/R4RK1 w - - 0 18,f1f6 d8f6 a1f1 f6h6 e5g4 h6g6 c3g7 e8e4 g4f6 g8g7,2610,105,84,71,advantage hangingPiece intermezzo middlegame veryLong,https://lichess.org/ZyKw24YE#35,Bishops_Opening Bishops_Opening_Vienna_Hybrid
00Nte,r4k2/8/2p3Bb/4p1n1/3q4/PQ6/2K2P2/1N4R1 w - - 3 30,g1g5 d4f2 b1d2 h6g5 b3f3 f2f3,1698,153,85,13,advantage intermezzo long middlegame,https://lichess.org/SO7vr4yL#59,
00Nua,8/1p1k2r1/p1p5/2P1R3/1P1pP3/P2r4/5RPK/8 w - - 1 31,a3a4 g7h7 h2g1 d3d1 f2f1 h7h1 g1h1 d1f1,1841,83,74,51,endgame,https://lichess.org/9qW9sLHW#61,
00O14,6k1/3P1pp1/4p3/p7/Q3R3/3q1PP1/1P3PK1/2r5 w - - 0 37,a4d4 d3f1 g2h2 f1h1,996,77,72,196,endgame mate mateIn2 short,https://lichess.org/IynnE0r9#73,
00O2z,r6r/2pk1ppp/p1np4/1pbBpN1q/4P1b1/5N2/PPPP1PRK/R1BQ4 w - - 12 18,h2g3 h5h3,751,111,85,42,mate mateIn1 middlegame oneMove,https://lichess.org/1pRUZ0aS#35,Ruy_Lopez Ruy_Lopez_Morphy_Defense
00O37,r1q1r1k1/1p3pp1/n1p4p/p1bpp2P/P3P3/2P2P2/1P1QBP2/R1BK3R b - - 3 23,c5f2 e2a6 b7a6 d2f2,1300,79,86,62,advantage discoveredAttack middlegame short,https://lichess.org/N2UAIb27/black#46,
00O3h,5k2/R3Rp2/6p1/1p5p/1P5K/2nr4/7P/8 b - - 7 43,d3d4 h4g5 c3e4 g5h6,1150,82,91,2227,crushing defensiveMove endgame short,https://lichess.org/71bhLvdU/black#86,
00O8m,r3r1k1/ppp2ppp/2nn1q2/8/3P4/P1P1P1P1/2Q3BP/R1B1KR2 b Q - 4 16,f6e6 d4d5 e6e5 d5c6,1409,75,87,1424,crushing fork middlegame short,https://lichess.org/G3Q51olU/black#32,Englund_Gambit_Declined Englund_Gambit_Declined_Reversed_French
00O9Z,5QR1/5p1p/1b3qp1/p6k/P2P4/8/1P2rPPP/5RK1 w - - 7 32,g8h8 f6f2 f1f2 e2e1 f2f1 b6d4 g1h1 e1f1,1628,77,85,915,backRankMate deflection endgame fork master mate mateIn4 pin sacrifice veryLong,https://lichess.org/DKnGKRmQ#63,
00O9a,1k3r2/q5r1/2Qp3p/N2Bp3/4P1p1/P7/1PP2PPP/R5K1 w - - 12 35,a5c4 a7f2 g1h1 f2f1 a1f1 f8f1,985,88,91,728,backRankMate long mate mateIn3 middlegame sacrifice,https://lichess.org/t6wbqTty#69,
00OCQ,1rr3k1/5p1p/p5pQ/4p3/4q3/B3P3/PPPR1PPP/2KR4 w - - 6 27,c2c3 c8c3 b2c3 b8b1,915,82,98,1021,mate mateIn2 middlegame queensideAttack sacrifice short,https://lichess.org/kcUnWeDs#53,
00OKo,r3r1k1/pbq5/1p2pp1p/2p1N3/2PP2Q1/1P1B4/P5PP/R5K1 b - - 1 24,g8f8 a1f1 c7g7 f1f6 g7f6 e5d7,2331,79,78,77,advantage exposedKing long middlegame pin sacrifice,https://lichess.org/WuHXkAoT/black#48,
00OLF,k1r5/n1p3p1/Q2pN3/P2Pp2p/q3Pp1P/2RK4/5PP1/8 w - - 4 36,e6c7 c8c7 c3c7 a4d1 d3c3 d1c1 c3b3 c1c7,2207,76,100,140,crushing endgame sacrifice skewer veryLong,https://lichess.org/REkdb3WG#71,
00ON5,8/k1p5/P7/3N4/3P2pp/3K2n1/6P1/8 w - - 1 47,d3e3 h4h3 e3f2 h3h2 f2g3 h2h1q,1849,75,87,141,advancedPawn crushing endgame knightEndgame long promotion,https://lichess.org/d71Ts3ff#93,
00OOp,5rk1/1bR3q1/pQ6/8/6r1/4R2P/P7/6K1 w - - 0 28,h3g4 g7g4 e3g3 g4g3,1053,91,86,85,endgame mate mateIn2 short,https://lichess.org/N1WcEYJH#55,
00OPc,1k1rr3/ppp1q3/8/4nQNp/8/2P4P/PP4P1/2K1R2R w - - 0 25,g5f3 e5d3 f5d3 d8d3 e1e7 e8e7,2107,75,98,420,advantage fork long middlegame,https://lichess.org/43yrfr28#49,
00OPi,5k2/5p1p/1p1P2p1/1B6/5P2/1P3KP1/n6P/8 w - - 0 38,f3e4 a2c3 e4d4 c3b5,614,86,96,497,advantage endgame fork master short,https://lichess.org/4K29qsm1#75,
00OPk,6rk/7p/R2N3P/1r6/1P5K/P7/8/8 b - - 4 50,b5d5 d6f7,815,103,93,915,endgame mate mateIn1 oneMove,https://lichess.org/aDJVIeGE/black#100,
00OQt,8/8/8/p3b3/P1B2pKp/1Pk1p2P/6P1/8 w - - 8 50,g4h4 c3d2 h4g4 e3e2 c4e2 d2e2,1680,75,88,360,advancedPawn bishopEndgame crushing endgame long,https://lichess.org/vZaFj9IE#99,
00OR6,2r4k/5Q1p/p7/1pq5/4p2N/2P3bP/PP4P1/4R2K b - - 0 34,g3e1 f7f6 h8g8 h4f5 c5f5 f6f5,2265,79,81,117,advantage endgame long quietMove,https://lichess.org/kMLJ7GPV/black#68,
00OXc,8/5K1p/1p4pk/8/3brp2/5R2/8/8 b - - 5 50,g6g5 f3h3,843,108,93,885,endgame master mate mateIn1 oneMove,https://lichess.org/Dp1LJyaZ/black#100,
00OYl,3r4/5p2/k3p1p1/2B1Pr2/2P3n1/1p3NPp/4QP1P/6K1 w - - 0 34,f3h4 f5e5 e2f1 e5c5,1918,75,89,72,crushing endgame fork short,https://lichess.org/es489ddj#67,
00Ocp,r3k3/p1pbq3/2p2p2/4p1p1/2B3p1/2P4r/P1P2PQP/3RR1K1 b q - 3 20,e7c5 g2e4 f6f5 e4e5 c5e5 e1e5,2098,145,73,19,crushing exposedKing long middlegame,https://lichess.org/fCyysDNm/black#40,
00Oim,1r3rk1/q5pp/2R5/3P4/8/1p2NpPb/1P3P1P/2QR2K1 w - - 0 32,c1c4 a7e3 f2e3 f3f2,1175,78,94,715,advancedPawn advantage middlegame sacrifice short,https://lichess.org/p1cFe6Z8#63,
00Oqz,5r2/7r/2kpqB1P/p1p1p2Q/P3P3/2PP4/5P1K/6R1 w - - 0 40,g1g6 f8f6 g6f6 e6f6,860,94,93,434,crushing endgame master short,https://lichess.org/OxaRmufB#79,
00Or5,r2qkbnr/pp5p/8/4Nb2/3p4/1QN5/PP2PPPP/R3KB1R b KQkq - 1 12,d4c3 b3f7,1507,88,57,250,mate mateIn1 oneMove opening,https://lichess.org/29LGsamW/black#24,Slav_Defense Slav_Defense_Other_variations
00OxK,3r2k1/1p3p2/p1n2P2/2P3P1/1P2p3/P2pP3/3B4/2R3K1 w - - 0 33,c1c4 c6e5 c4e4 e5f3 g1f2 f3d2,1249,96,100,59,advantage endgame exposedKing fork long,https://lichess.org/xZGqOSNB#65,
00Oyf,8/1p6/7p/3k1pp1/1P5P/3K1P2/6P1/8 w - - 0 39,h4g5 h6g5 d3c3 d5e5 c3c4 e5f4 c4c5 f4g3,2709,87,83,185,crushing endgame pawnEndgame veryLong zugzwang,https://lichess.org/eysZBqWU#77,
00Ozz,3kRr2/3n1B1p/2pP4/p1n5/Ppp5/8/1P3PPP/4R1K1 b - - 8 32,f8e8 e1e8,865,100,84,197,endgame mate mateIn1 oneMove,https://lichess.org/gO3w1uZJ/black#64,
00P45,3r1r2/p1p2p1k/1p2pPpp/7P/3qBQ2/8/PPP3P1/5R1K b - - 0 27,e6e5 h5g6 f7g6 f4g4 f8f6 f1f6 d4d1 g4d1 d8d1 h1h2,2496,89,85,59,advantage endgame veryLong,https://lichess.org/HlG7NGUO/black#54,
00P6j,r2n2k1/1bRq1rpp/1p6/3P4/p3Q3/B3P3/PP3PPP/3R2K1 b - - 0 20,d7c7 e4e8 f7f8 e8f8,1326,75,84,540,kingsideAttack mate mateIn2 middlegame short,https://lichess.org/vBpR18cI/black#40,
00P6s,Qn3rk1/p1p3pp/1p2Pb2/8/3q4/5P2/PPP4P/R3KBNR w KQ - 0 14,a8e4 f6h4 e1e2 d4f2,1613,75,92,717,advantage middlegame short,https://lichess.org/tgzabEkd#27,Dutch_Defense Dutch_Defense_Manhattan_Gambit
00P7n,r4rk1/p1p1R1pp/2p2p2/5P2/6Q1/1P5P/q5PK/8 b - - 1 30,a2b3 g4g7,1048,211,73,14,endgame mate mateIn1 oneMove,https://lichess.org/bFrOMLOq/black#60,
00P81,6k1/5p2/4p2p/3pPP2/1R5P/7r/2B5/2b2K2 b - - 0 46,h3c3 b4b8 g8h7 f5e6 c3c2 e6e7,2228,76,93,7271,advancedPawn crushing discoveredAttack endgame long sacrifice,https://lichess.org/SIETCqbJ/black#92,
00PF3,2kr3r/Qpp2ppp/3b1n2/8/3N4/4P1Pq/PP1B1P1P/2R2RK1 w - - 4 18,d4b5 f6g4 b5d6 d8d6 c1c7 c8c7,1392,76,87,276,advantage long middlegame,https://lichess.org/c2JUCAZJ#35,Queens_Gambit_Declined Queens_Gambit_Declined_Baltic_Defense
00PGi,3r1q1k/pppb2pp/2np4/6N1/5B2/1Q4P1/PP4PP/4R2K b - - 11 24,b7b6 g5f7 f8f7 b3f7,1029,84,93,1081,crushing fork middlegame short,https://lichess.org/qzZ4hC7X/black#48,
00PHg,R7/P4p2/5k1p/q5n1/5R2/7P/5PK1/8 b - - 2 46,f6e5 a8e8 e5f4 a7a8q a5a8 e8a8,1400,76,94,2112,advancedPawn advantage clearance endgame long promotion,https://lichess.org/u5o6sm6r/black#92,
00PIO,2k1r2r/1p2P3/p1b1p3/3p1npp/5q2/1N3N1Q/PP3PPP/2R2RK1 w - - 1 22,f3d4 f5d4 b3d4 f4d4 h3e6 c8c7,2295,82,87,787,crushing long middlegame,https://lichess.org/QcmS4aBG#43,
00PUc,3r3k/pp4bp/3Bn1p1/7n/8/8/PP3P1K/R4RN1 w - - 1 27,a1d1 d8d6 d1d6 g7e5 h2h1 e5d6,1474,75,100,748,advantage attraction exposedKing fork long middlegame sacrifice,https://lichess.org/F6OhRxfl#53,
00PZo,7r/8/3b4/3p4/5PR1/2kN4/4KP2/8 w - - 1 67,f4f5 h8e8 e2f3 c3d3,1130,75,100,259,advantage deflection endgame short,https://lichess.org/XUilKWZg#133,
00Pbs,3r1rk1/Q3qppp/8/1ppb4/2Pn1B1n/2N3P1/PP3P2/R2R1K2 w - - 0 21,a7e7 d5g2 f1e1 h4f3,2095,76,66,190,mate mateIn2 middlegame short,https://lichess.org/fA2DSaPB#41,
00Pc8,rnb2r2/pp4k1/2p3pp/4Np2/2BP4/8/PP4PP/2KRR3 b - - 0 18,b8d7 e5d7 c8d7 e1e7 g7f6 e7d7,1087,77,100,151,advantage clearance fork long middlegame,https://lichess.org/2yTBJXpZ/black#36,Caro-Kann_Defense Caro-Kann_Defense_Hillbilly_Attack
00PgQ,3r4/P1R5/7P/4p3/8/4p3/2p1K3/1k6 w - - 1 55,e2e3 c2c1q c7c1 b1c1 e3e4 d8e8,2199,75,87,172,advancedPawn crushing defensiveMove endgame long master promotion,https://lichess.org/6ByRjehu#109,
00Pgk,r2q1rk1/pbp1bp2/1p2pn1Q/5nN1/8/P1NB4/1PP3PP/R4RK1 w - - 2 17,d3f5 d8d4 g1h1 e6f5,2415,80,84,138,advantage intermezzo middlegame short,https://lichess.org/pe4L6fzJ#33,French_Defense French_Defense_Henneberger_Variation
00Pms,r1b1kr2/p1p2pQp/1p2pP2/8/8/1P4P1/P2KNP1P/R1B4q b q - 0 17,c8a6 g7f8 e8f8 c1a3 f8e8 a1h1,2159,90,86,33,advantage attraction discoveredAttack long middlegame sacrifice,https://lichess.org/UXAS6vpF/black#34,French_Defense French_Defense_Other_variations
00Pr6,r1b2rk1/p4ppp/2p5/6q1/2p3P1/3P1Q1P/PPP5/1K2RR2 b - - 0 17,c4d3 f3f7 f8f7 e1e8 f7f8 f1f8,1433,78,94,2093,kingsideAttack long mate mateIn3 middlegame sacrifice,https://lichess.org/CtrEbVZV/black#34,Kings_Knight_Opening Kings_Knight_Opening_Normal_Variation
00PrK,r7/7R/P3k3/4p2p/3b2p1/3K4/8/5R2 b - - 7 55,a8a6 h7h6 e6d5 h6a6,969,81,91,183,crushing endgame short skewer,https://lichess.org/N9FWAV9a/black#110,
00Pu5,6k1/1b3pbp/6p1/1Nr3q1/1Q1p4/P7/5PPP/4RBK1 b - - 0 27,c5c1 e1e8 g7f8 b4f8,1394,221,0,13,master mate mateIn2 middlegame short,https://lichess.org/x04vixVv/black#54,
00PvP,8/6B1/7p/1p4p1/1Pp3P1/5P1k/4K2b/8 b - - 18 51,h6h5 g4h5 h3h4 h5h6 h4h5 h6h7,843,96,74,114,advancedPawn bishopEndgame crushing endgame long,https://lichess.org/M7zTwdgr/black#102,
00PvX,8/n7/P7/3k4/PK6/7P/5PP1/8 w - - 0 53,b4a5 d5c5 f2f3 a7c6,1660,75,86,241,endgame knightEndgame mate mateIn2 short,https://lichess.org/tH6dRFcZ#105,
00Pw1,5r1k/2p3Rp/3p4/p2Pn3/1p2B3/1P6/PKP2r1P/6R1 b - - 1 28,f2e2 g7h7,1086,76,98,956,endgame master mate mateIn1 oneMove,https://lichess.org/WAkWH6IK/black#56,
00Q4m,5r2/1b3k2/1q4p1/p3Pp1p/2pn1P1P/4Q1P1/P6K/R1R2B2 w - - 2 34,f1g2 d4f3 e3f3 b7f3,1132,77,100,382,advantage middlegame short,https://lichess.org/LOKLTnN2#67,
00Q4v,8/2p1b3/q1Pp2k1/3Pp3/4Pr2/1Q3PK1/3N2P1/7R w - - 1 47,h1e1 e7h4 g3h2 h4e1,1228,81,74,64,crushing endgame short skewer,https://lichess.org/gHKVgDSR#93,
00Q8H,8/5b2/3k3p/6p1/3P1pP1/2N2K1P/8/8 w - - 6 48,h3h4 f7d5 f3f2 g5h4,1765,75,100,64,crushing endgame short,https://lichess.org/hnFaWMYG#95,
00QBx,rn1qk2r/pb3ppp/5n2/2b5/7N/2N1p1P1/PP1PPP1P/R1BQKB1R w KQkq - 0 9,h4g2 e3f2,1222,77,89,389,advancedPawn attackingF2F7 mate mateIn1 oneMove opening,https://lichess.org/85qqz7lO#17,English_Opening English_Opening_Kings_English_Variation
00QCD,3r1rk1/1Q3ppp/1q2pb2/8/1P1N4/4P1P1/3B1PBP/R5K1 b - - 0 23,b6b7 g2b7 f6d4 e3d4,1041,79,94,241,advantage middlegame short,https://lichess.org/AFf6cmqa/black#46,
00QCe,1k5r/n2r2pp/5p2/ppN5/5P2/8/2R3PP/1R4K1 b - - 3 28,d7c7 c5a6 b8b7 a6c7,1400,75,93,1303,crushing endgame fork short,https://lichess.org/fovXj5D1/black#56,
00QHM,6k1/pp3rpp/4Nb2/4p3/1B1r4/6PK/PP5P/2R5 b - - 0 28,d4b4 c1c8 f6d8 c8d8 f7f8 d8f8,906,98,95,224,endgame long mate mateIn3,https://lichess.org/VyUHT6ng/black#56,
00QN3,r1b1B2k/pp4pp/2pb4/4q3/8/8/PPP3PP/R2Q1R1K w - - 1 17,g2g3 e5e4 d1f3 e4e8,1901,76,86,185,advantage fork middlegame short,https://lichess.org/uMpuXTye#33,Blackmar-Diemer_Gambit_Accepted Blackmar-Diemer_Gambit_Accepted_Euwe_Defense
00QOa,6rk/1pp1R1p1/6Bp/2b4P/8/pP3PK1/P1P5/8 w - - 5 32,e7c7 c5d6 f3f4 d6c7,861,108,95,528,crushing endgame fork short,https://lichess.org/afclLtrR#63,
00QOp,4r3/pp2rkp1/2p5/P2p2pP/R4bP1/2NQ4/1PP2P2/3Kq2R w - - 3 25,h1e1 e7e1,427,94,100,159,mate mateIn1 middlegame oneMove,https://lichess.org/7puRAwZg#49,
00QQS,2r3k1/1p1q1ppp/4p3/Q7/3P4/P1B5/1Pr2PPP/R5K1 b - - 0 22,d7d4 c3d4 c2c1 a5e1,1828,167,43,18,advantage endgame hangingPiece short,https://lichess.org/tG606j71/black#44,
00QVZ,8/7p/4K3/6p1/2k3P1/8/5P2/8 b - - 0 43,c4d4 e6f5 h7h6 f5g6 d4e4 g6h6,1487,76,81,528,crushing endgame long master pawnEndgame,https://lichess.org/gVqoHhuS/black#86,
00QW1,8/3r1ppp/4p3/k3P3/pR2R2P/2P5/2Kr1PP1/8 w - - 4 31,c2c1 d2d1 c1b2 d7d2 b2a3 d1a1,984,96,95,242,endgame exposedKing long mate mateIn3 rookEndgame,https://lichess.org/I3LnvYRW#61,
00QY3,2k3r1/pp5p/4p3/2p2p2/2P5/P4P1q/1PQ1RR1b/7K w - - 0 32,f2h2 h3f1,1048,76,88,283,endgame master mate mateIn1 oneMove,https://lichess.org/Ip4qQXo1#63,
00QZ3,r1bq3r/ppppnkpp/2n5/b5N1/4P3/B1P5/P4PPP/RN1QK2R b KQ - 1 9,f7f8 d1f3 f8e8 f3f7,1137,86,92,1634,mate mateIn2 opening short,https://lichess.org/PiCJ1gmH/black#18,Scotch_Game Scotch_Game_Scotch_Gambit
00QZV,r1bk4/pppp3p/2n5/2b1prN1/8/1B6/PPPP2PP/RNB2RK1 w - - 1 14,g1h1 f5f1,599,88,33,65,backRankMate hangingPiece mate mateIn1 middlegame oneMove,https://lichess.org/0CTltFgg#27,Italian_Game Italian_Game_Two_Knights_Defense
00QjF,8/8/1pr1p1kp/pbPp2pN/3Pp1P1/1P2K3/P6P/2R5 b - - 0 29,e6e5 c5b6 c6c1 b6b7 c1e1 e3d2,2077,76,86,704,advancedPawn crushing endgame long master sacrifice,https://lichess.org/oPvDBkpv/black#58,
00QkV,5k1r/p3Rpbp/3N2p1/4nbB1/2P5/3rP3/q4PPP/3Q1RK1 b - - 2 16,f7f6 e7e8,1037,76,100,630,middlegame,https://lichess.org/R69epPjY/black#32,Grunfeld_Defense Grunfeld_Defense_Three_Knights_Variation
00Qlc,8/5R2/P7/2p1r3/2Pp2k1/3K4/5p2/8 b - - 1 54,e5f5 f7f5 g4f5 d3e2 f2f1q e2f1,1552,74,93,1324,crushing endgame long rookEndgame,https://lichess.org/CvcBVbVr/black#108,
00Qm5,r2q1rk1/p3b1pp/2p5/4ppB1/4p1nP/2N5/PPP1QPP1/3R1RK1 b - - 8 15,d8c7 e2c4 g8h8 c3d5 c6d5 c4c7,1823,76,93,8668,crushing long middlegame,https://lichess.org/8fF68Ntt/black#30,Queens_Pawn_Game Queens_Pawn_Game_Morris_Countergambit
00QnO,1k1r1r2/pp4p1/6q1/2Qp4/5bP1/2P4p/PPN3NP/R4R1K w - - 0 30,g2f4 g6e4 h1g1 f8f4,1428,75,92,3195,crushing fork intermezzo middlegame short,https://lichess.org/9GENZopF#59,
00Qo8,8/8/RP4p1/1r1N1pkp/P1n1p3/6P1/6P1/4K3 b - - 0 49,b5d5 b6b7 d5d8 a6a8,1054,82,94,274,endgame,https://lichess.org/Sxlq7BKB/black#98,
00Qog,1r3rk1/pP2qppp/1b3n2/1Q2p3/4P3/2NP1bP1/PP2NP1P/R1B2RK1 w - - 1 15,c1g5 e7e6 e2f4 e5f4,2098,75,92,3500,crushing middlegame short,https://lichess.org/5wfin3S4#29,English_Opening English_Opening_Carls-Bremen_System
00Qpu,3r1b1r/2pn4/1p1p3p/2kP2qn/Q3Pp2/4Bp2/1P4PP/4R1K1 b - - 3 26,f4e3 e1c1,1291,76,87,718,mate mateIn1 middlegame oneMove,https://lichess.org/GLsIyi7p/black#52,
00QqI,r6r/pQ2nkpp/4b3/2p1q3/4p3/2N5/PP1B1PPP/R4RK1 w - - 1 15,c3e4 e6d5 e4g5 e5g5 d2g5 d5b7,1698,74,82,102,advantage long middlegame,https://lichess.org/71TDmfZz#29,Scotch_Game Scotch_Game_Scotch_Gambit
00QyM,8/3k4/1pp3p1/4Pp1p/2PK1P1P/pP6/P7/8 b - - 1 35,d7e6 b3b4 e6e7 b4b5 c6b5 c4b5,2234,76,94,1230,crushing endgame long pawnEndgame quietMove zugzwang,https://lichess.org/DcRRuwOx/black#70,
00R0l,rnbqkb1r/pp3p1p/6pP/P1ppp3/6n1/3P1P2/1PP1P1P1/RNBQKBNR b KQkq - 0 7,g4h6 c1h6 f8h6 h1h6,1293,78,88,1511,advantage opening short,https://lichess.org/y06s0jL8/black#14,Ware_Opening Ware_Opening_Other_variations
00R0m,8/4k2p/Q1p1p3/p2pP1r1/q7/P6P/1P3PK1/2R2R2 w - - 1 28,g2f3 a4e4,1355,98,38,33,endgame mate mateIn1 oneMove,https://lichess.org/qcC85YJl#55,
00R2A,2kr1b1R/p5p1/8/3P1p2/8/4B3/PPPK1P2/8 w - - 1 25,c2c4 f8b4 d2d3 d8h8,838,78,99,1454,crushing discoveredAttack endgame short,https://lichess.org/ZjzT3REI#49,
00R4l,r1b5/p4pkp/3p2p1/2pPr3/2P5/1P1B4/R4PPP/R5K1 w - - 0 24,a2a7 a8a7 a1a7 e5e1 d3f1 c8f5,1550,75,84,1556,advantage defensiveMove endgame long,https://lichess.org/IQW9ts1W#47,
00R8C,r4q1k/2bn2p1/2p3pp/1pP5/1P1B2P1/1Q1P1r1P/5PB1/4RRK1 w - - 0 27,g2f3 f8f4 d4g7 h8h7 e1e5 d7e5 g7e5 c7e5 f1e1 f4f3,2411,98,82,44,crushing fork master middlegame veryLong,https://lichess.org/ZILz4GAu#53,
00R9D,8/1k6/1pn1R3/8/Pp4p1/4P3/5PK1/8 w - - 0 51,e6e4 b4b3 e4g4 b3b2,1220,168,82,8,advancedPawn crushing endgame short,https://lichess.org/3ZXSyu03#101,
00ROK,5k2/p1p2R2/1r2rp2/3p1Q2/2qP2R1/2P4P/6PK/4q3 b - - 0 33,f8f7 f5h7 f7f8 g4g8,1366,78,89,771,endgame mate mateIn2 short,https://lichess.org/EXabGwlP/black#66,
00RPk,8/2p5/5ppp/1PkP4/p4PPP/P1K5/8/8 b - - 0 39,c5b5 c3d4 c7c5 d5c6 b5c6 d4c4,2417,84,93,1306,advantage defensiveMove enPassant endgame long pawnEndgame,https://lichess.org/vOFXdfEu/black#78,
00RWr,6k1/5pp1/n3p2p/1q1pN3/8/4PB1P/Q4PPK/2r5 b - - 3 36,a6c5 a2a8 g8h7 e5f7 b5b2 a8h8 h7g6 h8g8 g6f6 f3h5,2920,118,87,479,crushing defensiveMove deflection endgame veryLong,https://lichess.org/20uXWTrv/black#72,
00RXz,1k1r4/pp1b4/2pq1p1p/6p1/8/1Q4P1/PP3PBP/3R2K1 b - - 0 27,d6e6 b3e6 d7e6 d1d8,1214,76,80,254,advantage endgame queensideAttack short,https://lichess.org/KgK5s7Qu/black#54,
00RYH,1k5r/ppp1R2p/3r1p2/5Q2/3p4/2qP4/2P2PPP/2K1R3 b - - 5 26,d6a6 e7e8 h8e8 e1e8,1029,83,89,119,backRankMate endgame mate mateIn2 short,https://lichess.org/qGI2u50w/black#52,
00RbX,3r2k1/2q1bppp/b3n3/p2N4/2p1P3/P3QN2/1PP2PPP/4R1K1 b - - 1 22,e7c5 d5c7 c5e3 c7e6 e3f2 g1f2,1616,77,79,112,advantage long middlegame,https://lichess.org/vo7nrvYf/black#44,
00Rcs,3k4/ppp2p1r/4p2P/5n2/3Pp1N1/2P2K2/P1P3P1/7R w - - 0 30,f3e4 f5g3 e4f4 g3h1,867,87,95,2248,crushing endgame fork short,https://lichess.org/6z8dEdCK#59,
00Rep,8/8/b1k5/p1N5/2p5/1P4P1/P6P/6K1 w - - 1 51,c5a6 c4c3 b3b4 c3c2,1622,75,94,624,advancedPawn crushing endgame knightEndgame short,https://lichess.org/jXFjUSJk#101,
00Rk3,8/1p2rppk/5q1p/Q4R2/2P5/PP5P/5PP1/5rK1 w - - 0 32,g1f1 f6a1 a5e1 e7e1,843,86,100,259,endgame mate mateIn2 short,https://lichess.org/9ceeRcuK#63,
00Rlv,r3k1nr/p1q3pp/1pb1p3/2b2p2/8/N1BQ1P2/PPP3PP/2KR3R b kq - 3 14,a8d8 d3d8 c7d8 d1d8,612,96,79,140,advantage middlegame short,https://lichess.org/DoFZ2KjY/black#28,Duras_Gambit Duras_Gambit_Other_variations
00Rmm,2rr2k1/5ppp/p7/1p1nP3/1B1P1PP1/PK5P/4R3/3R4 w - - 4 30,e2c2 c8c2 b3c2 d5e3 c2d3 e3d1,1446,75,98,1824,advantage attraction endgame fork long,https://lichess.org/MjgWCyPg#59,
00RoG,2kr2nr/pp2nppp/2pp4/2b2PP1/4NPq1/3B1R2/PPP4P/R2QB2K w - - 5 18,h2h3 g4g1,1012,102,94,682,mate mateIn1 oneMove opening,https://lichess.org/rOjlXCXv#35,Scotch_Game Scotch_Game_Other_variations
00RtC,r4k2/ppp3p1/3p3r/2q5/2NnP3/2Q2PBp/PP3R1P/5RK1 w - - 4 25,b2b4 d4e2 g1h1 c5f2 c3g7 f8g7,1948,82,86,55,advantage deflection discoveredAttack long middlegame pin,https://lichess.org/cgruxBCC#49,
00Ru6,3r1r2/p5kp/1p4pP/2p5/2PbBQ2/2q5/P1P1K3/5R2 b - - 0 34,g7h8 f4f8 d8f8 f1f8,974,84,80,72,mate mateIn2 middlegame short,https://lichess.org/SA1K2pZD/black#68,
00Rue,r2qkb1r/pp1nppp1/2p2n1p/3p1b2/3P4/BP2PN2/P1P2PPP/RN1QKB1R w KQkq - 2 7,c2c4 f5b1 a1b1 d8a5 b3b4 a5a3,1864,72,96,17106,advantage fork long opening,https://lichess.org/tgFzBrLu#13,Nimzo-Larsen_Attack Nimzo-Larsen_Attack_Classical_Variation
00Rvy,r6k/6bp/p7/2Q5/8/5P2/4bKPP/8 b - - 2 37,e2d3 c5d5 a8f8 d5d3,1296,84,9,54,advantage endgame fork short,https://lichess.org/AFL6C8p8/black#74,
00S5q,r4rk1/pbp1n1pp/1p1p4/3Pp1N1/2B4P/2PQ4/PP3qP1/R2K3R b - - 1 17,f2g2 d3h7,913,143,90,23,kingsideAttack mate mateIn1 middlegame oneMove,https://lichess.org/CwLT7XOm/black#34,Dutch_Defense Dutch_Defense_Raphael_Variation
00S6g,r6r/p3kpbp/2Q1pnp1/q7/P2P1P2/1PP5/6PP/R1B2RK1 b - - 0 16,f6d5 f4f5 g6f5 f1f5 f7f6 c1a3 e7f7 c6d7 f7g6 f5f3,2755,95,65,102,advantage middlegame veryLong,https://lichess.org/jFCmK1qh/black#32,Queens_Pawn_Game Queens_Pawn_Game_Other_variations
00S6j,3rr1k1/pp1q1pp1/1n1P1b1p/1Np5/8/1Q3N1P/PP3PP1/3R1RK1 b - - 2 20,a7a6 b5c7 d7c6 c7e8,1369,142,73,12,crushing master middlegame short,https://lichess.org/btjYBomF/black#40,
00SCA,8/2Q5/2p2nk1/8/2r2K2/8/8/8 w - - 4 71,f4e5 c4e4 e5d6 f6e8 d6d7 e8c7,1554,76,95,2557,crushing endgame fork long,https://lichess.org/JVchiAe8#141,
00SIE,2k3nr/ppp2ppp/2n5/8/8/1Q2P3/q2r1PPP/1R2KB1R b K - 1 15,d2f2 b3b7 c8d7 b1d1,1196,77,89,264,crushing fork middlegame short,https://lichess.org/sgBLVx00/black#30,Englund_Gambit Englund_Gambit_Hartlaub-Charlick_Gambit
00SIq,r3r1k1/1Q3ppp/8/pP6/2q5/7P/3R2P1/5R1K w - - 0 30,f1f7 c4f7 b7f7 g8f7,1903,75,83,245,crushing endgame short,https://lichess.org/WCK83FsZ#59,
00SLR,rnbqk1nr/ppppbppp/4p3/8/5P2/5N2/PPPPP1PP/RNBQKB1R w KQkq - 2 3,g2g4 e7h4 f3h4 d8h4,695,106,87,588,mate mateIn2 opening short,https://lichess.org/jqepvLa0#5,Bird_Opening Bird_Opening_Other_variations
00SMl,r4rk1/ppp2pn1/2np4/q2N4/3PP3/5P2/PPP5/1K1R1B1R b - - 2 18,c6b4 d5f6,876,97,94,1013,mate mateIn1 middlegame oneMove,https://lichess.org/vYCG7ony/black#36,Kings_Gambit_Accepted Kings_Gambit_Accepted_Cunningham_Defense
00SOy,6k1/6b1/p1r1p2p/1pN4r/3P3q/2P2Q2/P4PP1/1R2R1K1 w - - 2 31,f3c6 h4h1,831,101,97,592,mate mateIn1 middlegame oneMove,https://lichess.org/nkJegacG#61,
00SPy,4r3/5pk1/pp3p2/7q/1P3P1p/P6P/4R1P1/3Q1R1K b - - 0 34,e8e2 f4f5 g7h6 d1d8,2422,94,86,74,advantage endgame quietMove short,https://lichess.org/b7nzWOyx/black#68,
00STy,8/1R5R/4kpp1/4p3/4P2K/5P1P/r7/6r1 b - - 10 40,a2h2 b7b6,1515,80,83,631,endgame master mate mateIn1 oneMove rookEndgame,https://lichess.org/yc8Ey5PU/black#80,
00SU7,2rqr1k1/B2b1ppp/5n2/8/3Q4/3B4/P1P2PPP/R3R1K1 w - - 3 22,d4h4 e8e1 a1e1 d8a5 e1a1 a5a7,1632,74,95,5454,advantage fork long middlegame,https://lichess.org/qmkkzrOG#43,
00SUF,1n6/1P6/5pp1/8/2k3PP/4P3/3K4/8 b - - 0 51,c4c5 h4h5 g6h5 g4h5 c5d6 h5h6,1344,78,64,864,crushing endgame knightEndgame long master,https://lichess.org/zGMp3vwR/black#102,
00SWh,rn5Q/ppk1np2/3B4/6N1/6b1/8/PPP1q3/2KR4 b - - 0 18,c7b6 h8d4 b6c6 d4c3 c6d7 d1e1,2784,113,88,752,crushing exposedKing long middlegame,https://lichess.org/SIKtKv2M/black#36,Kings_Gambit_Accepted Kings_Gambit_Accepted_Bishops_Gambit
00Se9,5rk1/pp1n2r1/3p2N1/2pQ4/2P5/4P1P1/qP2KPP1/7R b - - 1 24,g7f7 g6e7 g8g7 d5g5,1878,75,96,3565,mate mateIn2 middlegame pin short,https://lichess.org/cMwUzce9/black#48,
00SeK,7k/pp5p/4r1pP/5pP1/3Q1n2/P1P5/KP6/5q2 b - - 1 35,h8g8 d4g7,995,179,89,29,endgame mate mateIn1 oneMove,https://lichess.org/GRpzFRNZ/black#70,
00SfT,r4rk1/pb2ppb1/1q6/6PQ/8/2NP1N2/PPnK1PP1/R6R b - - 1 16,c2a1 h5h7,1043,86,93,960,mate mateIn1 middlegame oneMove,https://lichess.org/5y0Ha2gI/black#32,Scandinavian_Defense Scandinavian_Defense_Modern_Variation
00SgB,b3rrk1/qn2R3/1p3ppp/1P1p4/1Q1PnB2/P3P3/4BPPP/5RK1 b - - 0 28,e8e7 b4e7 f8f7 e7e8 g8g7 f4h6,1212,75,96,1316,advantage exposedKing kingsideAttack long middlegame,https://lichess.org/twcqryGo/black#56,
00SiY,8/8/3p2N1/3Pp1n1/4Pp1p/3k1P1P/6K1/8 w - - 8 57,g6h4 d3e2 h4f5 g5f3,2109,80,91,2577,crushing endgame knightEndgame master short zugzwang,https://lichess.org/nqOd6mWK#113,
00SlL,r5k1/2p1qp1p/2b1p1pQ/pp5P/3P2P1/3P1r2/PP2N3/2KR3R b - - 0 23,f3d3 d1d3 c6h1 h5g6 f7g6 h6h1,2439,78,90,652,advantage discoveredAttack long middlegame,https://lichess.org/ktai3EiG/black#46,
00Sr6,4r2k/pQ5p/1p3p2/8/2p2P2/P6q/8/3R1RK1 w - - 0 37,b7f3 e8g8 g1f2 h3h2,1520,96,81,39,advantage endgame master short,https://lichess.org/jfGXGyER#73,
00SsI,6R1/p4p1p/2p1pp1k/8/2N5/4b1R1/4K1PP/2q5 b - - 1 29,e3g5 g3h3 g5h4 h3h4,1098,76,94,809,endgame,https://lichess.org/WfTPI1ZC/black#58,
00Svg,8/p7/1p4k1/2pN2p1/4Pp2/P1P4r/1P3KR1/8 w - - 6 50,f2e2 f4f3 e2f2 f3g2,1182,78,64,102,advancedPawn advantage endgame fork master short,https://lichess.org/hCcakyYf#99,
00SyL,1rb2rk1/4bppp/p1n1p3/1p1qP3/7N/P5P1/1PQ2PBP/R1B2RK1 b - - 1 15,d5c5 c2c5 e7c5 g2c6,1281,78,92,5981,capturingDefender crushing opening short,https://lichess.org/f988q4eE/black#30,Sicilian_Defense Sicilian_Defense_Old_Sicilian
00Sz9,1r4k1/p4ppp/4p3/p5n1/4P3/1P1N1PPq/QB3b1P/R5K1 w - - 0 30,d3f2 g5f3 g1h1 h3h2,1011,77,90,814,kingsideAttack mate mateIn2 middlegame short,https://lichess.org/mJ2prRw1#59,
00T2k,2k5/p3qp2/bpp1p1p1/4P2r/P4n1p/5P2/BPQ2B1P/1K1R4 b - - 0 30,h5e5 c2c6 c8b8 d1d7 e7d7 c6d7,1521,76,95,872,advantage long middlegame queensideAttack,https://lichess.org/e3qC1Wvi/black#60,
00T4i,2r4k/q2b1Q1p/2p2P2/1p2p3/4P3/p2P3R/4N1rK/R7 w - - 0 38,h2g2 d7h3 g2h3 a7f7,1528,77,91,329,crushing discoveredAttack middlegame short,https://lichess.org/02qALj5P#75,
00T85,8/8/8/8/8/4K3/1k3Q2/1q6 b - - 5 53,b2c1 f2d2,1028,82,93,1510,endgame master mate mateIn1 oneMove queenEndgame,https://lichess.org/j3dOR5SJ/black#106,
00TAb,6k1/5pp1/p1N1b3/1n5p/1B4P1/P4P1P/2K5/8 b - - 2 42,e6d5 c6e7 g8h7 e7d5,710,96,94,307,advantage endgame fork master short,https://lichess.org/vPUJ0Lkg/black#84,
00TEQ,r3k1nr/1bq2ppp/p2p4/1p2p1NQ/3nP3/1BN4P/PP3PP1/R2R2K1 b kq - 2 15,g8f6 h5f7 c7f7 g5f7,2454,87,90,815,advantage attackingF2F7 middlegame short,https://lichess.org/1ix6qpqS/black#30,Sicilian_Defense Sicilian_Defense_Smith-Morra_Gambit_Accepted
00TFd,1R6/8/p1P3k1/6pp/1P6/6PK/r6P/8 w - - 1 40,c6c7 g5g4 h3h4 a2h2,1017,78,93,171,deflection endgame mate mateIn2 rookEndgame short,https://lichess.org/olkVoMlg#79,
00TLz,8/p3Q2p/6p1/4p1k1/5q2/8/Pr4PP/6K1 b - - 1 36,f4f6 h2h4 g5f5 g2g4 f5g4 e7f6,1457,75,82,545,advantage deflection endgame long,https://lichess.org/iQZPp2A2/black#72,
00TOX,b7/p1k1pp2/1pn2qp1/8/4B3/1PNR4/P1P2PP1/5K2 b - - 1 26,a7a6 c3d5 c7b8 d5f6,802,76,86,208,crushing endgame fork short,https://lichess.org/bAOdaE0p/black#52,
