PuzzleId,FEN,Moves,Rating,RatingDeviation,Popularity,NbPlays,Themes,GameUrl,OpeningTags
00008,r6k/pp2r2p/4Rp1Q/3p4/8/1N1P2R1/PqP2bPP/7K b - - 0 24,f2g3 e6e7 b2b1 b3c1 b1c1 h6c1,1877,76,95,8786,crushing hangingPiece long middlegame,https://lichess.org/787zsVup/black#48,
0000D,5rk1/1p3ppp/pq3b2/8/8/1P1Q1N2/P4PPP/3R2K1 w - - 2 27,d3d6 f8d8 d6d8 f6d8,1501,73,96,35000,advantage endgame short,https://lichess.org/F8M8OS71#53,
0008Q,8/4R3/1p2P3/p4r2/P6p/1P3Pk1/4K3/8 w - - 1 64,e7f7 f5e5 e2f1 e5e6,1355,76,91,743,advantage endgame rookEndgame short,https://lichess.org/MQSyb3KW#127,
0009B,r2qr1k1/b1p2ppp/pp4n1/P1P1p3/4P1n1/B2P2Pb/3NBP1P/RN1QR1K1 b - - 1 16,b6c5 e2g4 h3g4 d1g4,1103,74,88,603,advantage middlegame short,https://lichess.org/4MWQCxQ6/black#32,Kings_Pawn_Game Kings_Pawn_Game_Leonardis_Variation
000Pw,6k1/5p1p/4p3/4q3/3nN3/2Q3P1/PP3P1P/6K1 w - - 2 37,e4d2 d4e2 g1f1 e2c3,1422,74,92,604,crushing endgame fork short,https://lichess.org/au2lCK5o#73,
000Sa,2Q2bk1/5p1p/p5p1/2p3P1/2r1B3/7P/qPQ2P2/2K4R b - - 0 32,c4c2 e4c2 a2a1 c2b1,1537,76,96,93,advantage endgame short,https://lichess.org/lTTa9lwd/black#64,
000VW,r4r2/1p3pkp/p5p1/3R1N1Q/3P4/8/P1q2P2/3R2K1 b - - 3 25,g6f5 d5c5 c2e4 h5g5 g7h8 g5f6,2857,107,85,272,crushing endgame long,https://lichess.org/e9AY2m5j/black#50,
000Vc,8/8/4k1p1/2KpP2p/5PP1/8/8/8 w - - 0 53,g4h5 g6h5 f4f5 e6e5 f5f6 e5f6,1611,80,75,108,crushing endgame long pawnEndgame,https://lichess.org/l6AejDMO#105,
000Zo,4r3/1k6/pp3r2/1b2P2p/3R1p2/P1R2P2/1P4PP/6K1 w - - 0 35,e5f6 e8e1 g1f2 e1f1,1353,75,86,646,endgame mate mateIn2 short,https://lichess.org/n8Ff742v#69,
000aY,r4rk1/pp3ppp/2n1b3/q1pp2B1/8/P1Q2NP1/1PP1PP1P/2KR3R w - - 0 15,g5e7 a5c3 b2c3 c6e7,1430,78,75,525,advantage master middlegame short,https://lichess.org/iihZGl6t#29,Benoni_Defense Benoni_Defense_Benoni-Indian_Defense
000h0,5rk1/p5p1/3bpr1p/1Pp4q/3pR3/1P1Q1N2/P4PPP/4R1K1 w - - 4 22,e4e6 f6f3 g2f3 h5h2 g1f1 h2h3 f1e2 h3e6,2035,75,89,185,advantage interference kingsideAttack middlegame veryLong,https://lichess.org/OWe6M5dF#43,
000hf,r1bqk2r/pp1nbNp1/2p1p2p/8/2BP4/1PN3P1/P3QP1P/3R1RK1 b kq - 0 19,e8f7 e2e6 f7f8 e6f7,1620,74,92,682,mate mateIn2 middlegame short,https://lichess.org/71ygsFeE/black#38,Horwitz_Defense Horwitz_Defense_Other_variations
000jr,5k2/1p4pp/p5n1/5Q2/3BpP2/1P2PP1K/P1q4P/7r b - - 1 33,f8g8 f5d5 g8f8 d4c5 c2c5 d5c5,2053,217,100,25,crushing endgame long,https://lichess.org/JgxFj109/black#66,
000lC,3r3r/pQNk1ppp/1qnb1n2/1B6/8/8/PPP3PP/3R1R1K w - - 5 19,d1d6 d7d6 b7b6 a7b6,1391,76,94,4500,advantage hangingPiece middlegame short,https://lichess.org/vaqz2bx6#37,
000mr,5r1k/5rp1/p7/1b2B2p/1P1P1Pq1/2R1Q3/P3p1P1/2R3K1 w - - 0 41,e3g3 f7f4 e5f4 f8f4,1957,84,62,103,crushing middlegame short,https://lichess.org/8sVpuwso#81,
000o3,8/2p1k3/6p1/1p1P1p2/1P3P2/3K2Pp/7P/8 b - - 1 43,e7d6 d3d4 g6g5 f4g5,944,77,87,184,crushing endgame pawnEndgame short zugzwang,https://lichess.org/BAY91mF3/black#86,
000qP,8/7R/8/5p2/4bk1P/8/2r2K2/6R1 w - - 7 51,f2f1 f4f3 f1e1 c2c1 e1d2 c1g1,1999,78,92,976,crushing endgame exposedKing long skewer,https://lichess.org/r4xUR6fC#101,
000rO,3R4/8/K7/pB2b3/1p6/1P2k3/3p4/8 w - - 4 58,a6a5 e5c7 a5b4 c7d8,1110,82,85,69,crushing endgame fork master short,https://lichess.org/tzeeBEc2#115,
000rZ,2kr1b1r/p1p2pp1/2pqb3/7p/3N2n1/2NPB3/PPP2PPP/R2Q1RK1 w - - 2 13,d4e6 d6h2,739,89,100,375,kingsideAttack mate mateIn1 oneMove opening,https://lichess.org/seIMDWkD#25,Scandinavian_Defense Scandinavian_Defense_Modern_Variation
00143,r2q1rk1/5ppp/1np5/p1b5/2p1B3/P7/1P3PPP/R1BQ1RK1 b - - 1 17,d8f6 d1h5 h7h6 h5c5,1780,77,91,2876,advantage middlegame short,https://lichess.org/jcuxlI63/black#34,Scotch_Game Scotch_Game_Mieses_Variation
0017R,r2qk2r/pp2ppbp/1n1p2p1/3Pn3/2P5/2NBBP1P/PP3P2/R2QK2R b KQkq - 0 12,e5c4 d3c4 b6c4 d1a4 d8d7 a4c4,1677,75,96,3974,advantage fork long middlegame,https://lichess.org/ol84k0z4/black#24,Alekhine_Defense Alekhine_Defense_Other_variations
0018P,5R2/1p6/p1p5/2P1rk2/2K3p1/2P1p1P1/1P5P/8 b - - 1 44,f5e6 f8e8 e6f5 e8e5 f5e5 c4d3 e5d5 d3e3 a6a5 e3f4 d5c4 f4g4,1904,75,100,127,crushing endgame exposedKing rookEndgame veryLong,https://lichess.org/Xg1Gtfjr/black#88,
0018S,2kr3r/pp3p2/4p2p/1N1p2p1/3Q4/1P1P4/2q2PPP/5RK1 b - - 1 20,b7b6 d4a1 a7a5 f1c1,2566,114,90,1801,advantage endgame pin short,https://lichess.org/H1ARO2GL/black#40,
001Fg,2R2r1k/pQ4pp/5rp1/3B4/q2n4/7P/P4PP1/5RK1 w - - 3 30,c8c7 d4e2 g1h2 a4f4 h2h1 e2g3 f2g3 f4f1,1516,76,94,1426,advantage middlegame veryLong,https://lichess.org/y0QalMAw#59,
001Hi,6k1/pp1r1pp1/1qp1p2p/4P2P/5Q2/1P4R1/P1Pr1PP1/R5K1 b - - 4 23,b6d4 f4f6 d4f2 f6f2 d2f2 g1f2,2389,115,58,19,advantage endgame long pin,https://lichess.org/tUkE0z1z/black#46,
001KR,6Qk/p1p3pp/4N3/1p6/2q1r1n1/2B5/PP4PP/3R1R1K b - - 0 28,h8g8 f1f8,565,83,100,114,mate mateIn1 middlegame oneMove,https://lichess.org/TaT1Zl7z/black#56,
001Oo,6k1/4p1bp/6p1/1p1pP3/1PpPp3/2P1P3/Q2B1KPP/3q4 b - - 2 23,d1a4 a2a4 b5a4 b4b5 g8f7 b5b6,2078,78,84,61,crushing endgame long quietMove,https://lichess.org/8IKs77O9/black#46,
001Wz,4r1k1/5ppp/r1p5/p1n1RP2/8/2P2N1P/2P3P1/3R2K1 b - - 0 21,e8e5 d1d8 e5e8 d8e8,1118,82,89,81,backRankMate endgame mate mateIn2 short,https://lichess.org/84RH3LaP/black#42,
001XA,1qr2rk1/pb2bppp/8/8/2p1N3/P1Bn2P1/2Q2PBP/1R3RK1 b - - 3 23,b8c7 b1b7 c7b7 e4f6 e7f6 g2b7,1667,74,91,1335,crushing discoveredAttack long master middlegame sacrifice,https://lichess.org/KZRiN695/black#46,
001aK,6k1/5p2/4p3/P1B5/2P4P/4Pnp1/Rb1rN3/5K2 b - - 1 33,d2e2 f1e2 g3g2 e3e4 f3d4 e2f2,2027,78,92,257,crushing endgame hangingPiece long quietMove,https://lichess.org/Epr0AiEh/black#66,
001cr,8/3B2pp/p5k1/2p3P1/1p1p1K2/8/1P6/8 b - - 0 38,c5c4 d7e8,1606,83,93,2186,bishopEndgame endgame mate mateIn1 oneMove,https://lichess.org/7FFNwibw/black#76,
001gi,r6r/1pNk1ppp/2np4/b3p3/4P1b1/N1Q5/P4PPP/R3KB1R w KQ - 3 18,c7a8 a5c3,820,119,69,261,bodenMate hangingPiece mate mateIn1 middlegame oneMove,https://lichess.org/1sV2Hr22#35,Sicilian_Defense Sicilian_Defense_Other_variations
001h8,2r3k1/2r4p/4p1p1/1p1q1pP1/p1bP1P1Q/P6R/5B2/2R3K1 b - - 5 34,c4e2 h4h7 c7h7 c1c8 g8g7 c8c7,1780,76,88,619,crushing deflection kingsideAttack long middlegame sacrifice,https://lichess.org/IxCahP6X/black#68,
001kG,rnbq3r/1p2bkpp/p4n2/8/2pNP3/2N5/PPP3PP/R1BQ1RK1 b - - 1 11,e7c5 d1h5 f7g8 h5c5,1904,75,94,315,advantage opening pin short,https://lichess.org/xXAEaVto/black#22,Sicilian_Defense Sicilian_Defense_Najdorf_Variation
001m3,7r/6k1/2b1pp2/8/P1N3p1/5nP1/4RP2/Q4K2 w - - 2 38,e2e6 h8h1 f1e2 h1a1,1459,76,87,278,advantage endgame short skewer,https://lichess.org/LELOz22f#75,
001om,5r1k/pp4pp/5p2/1BbQp1r1/6K1/7P/1PP3P1/3R3R w - - 2 26,g4h4 c5f2 g2g3 f2g3,1018,80,89,225,mate mateIn2 middlegame short,https://lichess.org/VWOIWtIh#51,
001pC,r4rk1/pp3ppp/3b4/2p1pPB1/7N/2PP3n/PP4PP/R2Q1RqK w - - 5 18,f1g1 h3f2,895,76,91,429,mate mateIn1 middlegame oneMove smotheredMate,https://lichess.org/d04UP3XD#35,Sicilian_Defense Sicilian_Defense_McDonnell_Attack
001u3,2r3k1/p1q2pp1/Q3p2p/b1Np4/2nP1P2/4P1P1/5K1P/2B1N3 b - - 3 33,c7b6 a6c8 g8h7 c8b7,2175,81,55,80,advantage hangingPiece middlegame short,https://lichess.org/BBn6ipaK/black#66,
001uD,6k1/1p3pp1/1p5p/2r1p3/2n5/r3PN2/2RnNPPP/2R3K1 b - - 1 32,f7f6 f3d2 c4d2 c2d2 c5c1 e2c1,1832,76,93,948,advantage long middlegame,https://lichess.org/2qkVLUl6/black#64,
001w5,1rb2rk1/q5P1/4p2p/3p3p/3P1P2/2P5/2QK3P/3R2R1 b - - 0 29,f8f7 c2h7 g8h7 g7g8q,1039,80,85,212,advancedPawn attraction mate mateIn2 middlegame promotion short,https://lichess.org/0e1vxAEn/black#58,
001wR,6nr/pp3p1p/k1p5/8/1QN5/2P1P3/4KPqP/8 b - - 5 26,b7b5 b4a5 a6b7 c4d6 b7b8 a5d8,1212,81,93,2599,endgame long mate mateIn3,https://lichess.org/ruvbd9JW/black#52,
001wb,r3k2r/pb1p1ppp/1b4q1/1Q2P3/8/2NP1Pn1/PP4PP/R1B2R1K w kq - 1 17,h2g3 g6h5,1252,77,93,207,mate mateIn1 middlegame oneMove,https://lichess.org/hNzYRMWP#33,Ruy_Lopez Ruy_Lopez_Bird_Variation
001wr,r4rk1/p3ppbp/Pp1q1np1/3PpbB1/2B5/2N5/1PPQ1PPP/3RR1K1 w - - 4 18,f2f3 d6c5 g1h1 c5c4,947,82,97,2328,advantage fork master masterVsMaster middlegame short,https://lichess.org/KnJ2mojX#35,Pirc_Defense Pirc_Defense_Classical_Variation
001xO,k1r1b3/p1r1nppp/1p1qpn2/2Np4/1P1P4/PQRBPN2/5PPP/2R3K1 w - - 0 19,d3a6 b6c5 a6c8 c5c4,1710,74,91,1335,crushing master masterVsMaster middlegame sacrifice short,https://lichess.org/fNCePFgY#37,Slav_Defense Slav_Defense_Other_variations
001xl,8/4R1k1/p5pp/3B4/5q2/8/5P1P/6K1 b - - 5 40,g7f6 e7f7 f6e5 f7f4,1105,83,94,11604,advantage endgame master masterVsMaster short skewer superGM,https://lichess.org/bEQkfPQD/black#80,
002CP,r5k1/pp4pp/4p1q1/4p3/3n4/P5P1/1PP2Q1P/2KR1R2 w - - 4 24,f2e3 g6c2,926,83,69,88,endgame mate mateIn1 oneMove queensideAttack,https://lichess.org/pHZnIFdb#47,
002Ds,8/1pp5/p2p4/P2Pk2p/1PP1p2P/2n1K2P/3N4/8 b - - 0 45,b7b6 b4b5 c3d1 e3e2 a6b5 a5a6,1980,75,90,111,crushing endgame knightEndgame long,https://lichess.org/2SrvOtZN/black#90,
002GQ,5rk1/5ppp/4p3/4N3/8/1Pn5/5PPP/5RK1 w - - 0 28,f1c1 c3e2 g1f1 e2c1,654,81,73,134,crushing endgame fork short,https://lichess.org/2K7g2pDT#55,
002HE,1qr2rk1/1p1p1ppp/pB2p1n1/7n/2P1P3/1Q2NP1P/PP2B1Pb/3R1RK1 w - - 1 20,g1f2 b8g3,1206,76,100,352,master mate mateIn1 middlegame oneMove,https://lichess.org/U21EXYdv#39,
002Hv,8/8/8/3N2p1/5b2/3p3P/5kP1/3K4 w - - 16 56,d5f4 g5f4 h3h4 f2g2 h4h5 f4f3 d1d2 f3f2,1603,87,63,25,advancedPawn crushing endgame veryLong,https://lichess.org/rLJ8Hp1v#111,
002IE,r3brk1/5pp1/p1nqpn1p/P2pN3/2pP4/2P1PN2/5PPP/RB1QK2R b KQ - 4 16,c6e5 d4e5 d6e7 e5f6,1205,85,74,35,advantage fork middlegame short,https://lichess.org/fDwvVUIp/black#32,Queens_Pawn_Game Queens_Pawn_Game_Accelerated_London_System
002KJ,r3kb1r/ppq2ppp/4pn2/2Ppn3/1P4bP/2P2N2/P3BPP1/RNBQ1RK1 b kq - 2 10,f8e7 f3e5 c7e5 e2g4,1643,76,90,1723,crushing discoveredAttack middlegame short,https://lichess.org/2NpTzh7O/black#20,Caro-Kann_Defense Caro-Kann_Defense_Advance_Variation
002LF,7r/p2q1pk1/1pp3p1/8/6P1/4Q3/PP1R1P1r/5KN1 b - - 0 38,d7g4 e3e5 f7f6 e5c7 g7h6 c7h2,2145,78,89,501,advantage endgame interference long,https://lichess.org/md88dHiL/black#76,
002LW,3r1rk1/1b1n1pp1/3p4/p4PPQ/4P3/3q1BN1/8/2R2RK1 b - - 1 28,d7e5 f5f6 e5f3 f1f3,2464,88,78,115,advantage middlegame short,https://lichess.org/0khwj5dv/black#56,
002Mm,rn1qr1k1/ppp3pQ/3p1pP1/3Pp3/2P1P3/8/PP3PP1/R1B1K3 b Q - 2 16,g8f8 h7h8 f8e7 h8g7,1276,99,100,33,deflection mate mateIn2 middlegame short,https://lichess.org/wAkPv4uG/black#32,Three_Knights_Opening Three_Knights_Opening_Other_variations
002O7,r3qrk1/2p2pp1/p2bpn1p/2ppNb2/3P1P2/1PP1P1B1/P2N2PP/R2Q1RK1 b - - 0 14,f5g4 e5g4 f6g4 d1g4,966,94,91,352,crushing middlegame short,https://lichess.org/dFEPPiEc/black#28,Queens_Pawn_Game Queens_Pawn_Game_Accelerated_London_System
002Q2,7k/p4R1p/3p3r/2pN1n2/2PbBBb1/3P2P1/P3r3/5R1K w - - 1 28,f4h6 f5g3,872,76,100,178,cornerMate mate mateIn1 middlegame oneMove,https://lichess.org/yqAJ1jMv#55,
002Tf,r3kbnr/ppp1qppp/2n5/3pP3/5B2/4PQ2/PPP2PPP/RN2KB1R w KQkq - 1 7,f1b5 e7b4 b1c3 b4b2,1564,75,84,176,advantage fork opening short,https://lichess.org/Zq56PwHK#13,Queens_Pawn_Game Queens_Pawn_Game_Chigorin_Variation
002Ua,r4rk1/pp3ppp/3p1q2/P1P1p3/2B5/2B2n2/2P2P1P/R2Q1RK1 w - - 0 16,g1h1 f6f4 d1f3 f4f3,1817,75,95,7843,crushing kingsideAttack middlegame short,https://lichess.org/06i3eMVp#31,Sicilian_Defense Sicilian_Defense_Lowenthal_Variation
002Uy,8/8/1p6/k7/P1R5/1K5r/8/8 w - - 26 64,c4c3 h3c3 b3c3 a5a4 c3b2 a4b4,1615,74,97,4568,crushing defensiveMove endgame long rookEndgame,https://lichess.org/sLU7YN1A#127,
002VP,8/6p1/2B1bn2/6k1/3B4/6K1/4P3/8 b - - 4 44,e6d5 d4f6 g5f5 c6d5,1469,79,72,141,crushing endgame short,https://lichess.org/7yJGEbUK/black#88,
002Z9,4r1k1/1p2R1p1/p2p2Pp/P1pP4/5q2/1R3p2/1P1Q3P/5B1K b - - 0 34,f4d2 e7e8,1231,99,69,51,endgame hangingPiece master mate mateIn1 oneMove,https://lichess.org/Ek4aENjD/black#68,
002bK,8/7p/2b1k3/p2p1pPB/1n1P3P/N1p1P3/4K3/8 b - - 1 42,c6b5 a3b5 c3c2 e2d2,1125,77,93,806,advantage endgame hangingPiece short,https://lichess.org/IFGj8W5s/black#84,
002e5,r2q4/pp1n1kbp/3P2b1/6N1/6Q1/P3P3/6P1/4K2R b K - 1 21,f7g8 g4c4 g8h8 h1h7 g6h7 g5f7,2619,79,85,374,crushing long middlegame sacrifice,https://lichess.org/qaapuG48/black#42,
002e8,r3nrk1/1b3pp1/4pb2/p3q3/1p1N4/3B2R1/PPPQN2P/1K4R1 b - - 1 23,a8d8 d2h6 g7g6 g3h3,2348,77,94,234,crushing defensiveMove master middlegame pin short,https://lichess.org/ygzu5djr/black#46,
002mG,5r1k/B1p3pp/2Qb1p2/3Pq3/P6P/8/2P3K1/3R1R2 w - - 1 36,g2f2 f8e8 c6e8 e5e8,2245,78,91,161,advantage middlegame quietMove short,https://lichess.org/age2hanq#71,
002p5,r1bqr1k1/pp1nbpp1/2p2n2/6P1/2BP4/P7/1PQNNPP1/R3K2R b KQ - 0 13,f6d5 c2h7 g8f8 h7h8,899,79,84,170,kingsideAttack mate mateIn2 middlegame short,https://lichess.org/meSoQkhU/black#26,French_Defense French_Defense_Exchange_Variation
002rd,r6k/q1pb1p1p/1b3Pr1/p1ppP2Q/3P2p1/4B3/PP2NRPP/3R2K1 b - - 1 25,d7e6 e2f4 c5d4 f4g6 f7g6 h5h6,1795,74,79,125,crushing kingsideAttack long middlegame pin,https://lichess.org/NcD6lul8/black#50,
002uV,r2r2k1/1p2qppp/2n1p3/5n2/p2P4/P2Q1N2/BP3PPP/2R1R1K1 w - - 4 20,d3f5 e6f5 e1e7 c6e7,1589,77,87,77,advantage middlegame short,https://lichess.org/WKH5eIti#39,
002vV,8/6k1/2R4p/5p1P/5P1K/6P1/8/r7 w - - 2 58,c6b6 a1h1,490,86,100,483,endgame master mate mateIn1 oneMove rookEndgame,https://lichess.org/KB7FAntf#115,
002xh,2nk4/8/2PBp1n1/1pK1P1p1/1P4P1/8/8/8 b - - 2 42,g6h4 c5b5 h4g2 b5a6 g2e3 a6b7,2065,96,54,34,crushing endgame long,https://lichess.org/TfRvsd3p/black#84,
0030b,6k1/5ppp/5nb1/pp6/6rP/5N1Q/Pq2r1P1/3R2RK b - - 4 32,g6e4 d1d8 f6e8 d8e8,617,81,90,167,backRankMate mate mateIn2 middlegame short,https://lichess.org/mhIZR6Mc/black#64,
00347,8/2p5/8/2pPk2p/8/4K2P/6P1/8 w - - 1 42,e3d3 h5h4 d3c4 e5d6,2264,75,87,122,crushing endgame pawnEndgame quietMove short,https://lichess.org/xFM0YP9S#83,
0039T,1r5r/p3kp2/4p2p/4P3/3R1Pp1/6P1/P1P4P/4K2R w K - 1 25,d4a4 b8b1 e1f2 b1h1 a4a7 e7f8,1081,89,93,808,crushing defensiveMove endgame long rookEndgame skewer,https://lichess.org/BrtVeJlj#49,
003AX,2r2rk1/5ppp/bq2p3/p1ppP1N1/Pb1P2P1/1P2P2P/2QN4/2R1K2R b K - 1 18,c5d4 c2h7,966,77,96,637,kingsideAttack mate mateIn1 middlegame oneMove,https://lichess.org/kRgejRSt/black#36,French_Defense French_Defense_Advance_Variation
003IX,8/3pk3/R7/1R2Pp1p/2PPnKr1/8/8/8 w - - 4 43,f4f5 e4g3,1713,83,88,1946,endgame mate mateIn1 oneMove,https://lichess.org/576Btq56#85,
003Jb,6k1/3bqr1p/2rpp1pR/p7/Pp1QP3/1B3P2/1PP3P1/2KR4 w - - 6 22,d4a7 e7g5 c1b1 g5h6,993,81,90,392,advantage fork master middlegame short,https://lichess.org/8RvK0idj#43,
003S3,r4k1r/pNqnppb1/6pn/2p3Np/7P/2P2Q2/PP3PP1/R1B1K2R b KQ - 2 15,a8b8 g5e6 f8g8 e6c7,1437,75,95,12720,advantage middlegame pin short,https://lichess.org/Eu6S0GPA/black#30,Modern_Defense Modern_Defense_Other_variations
003Tx,2r5/pR5p/5p1k/4p3/4r3/B4nPP/PP3P2/1K2R3 w - - 0 27,e1e4 f3d2 b1a1 c8c1,1518,87,82,745,backRankMate endgame fork mate mateIn2 short,https://lichess.org/A7j9VEC0#53,
003UW,8/6pk/7p/2p5/2qp4/5PP1/P3QK1P/8 b - - 1 40,c4d5 e2e4 d5e4 f3e4,1457,75,93,972,advantage endgame queenEndgame short,https://lichess.org/cXMga3rb/black#80,
003YF,r4rk1/1pp2ppp/p2p4/2bPp3/2P1Pn1q/P1N2B2/1P3P2/R1BQK1R1 w Q - 1 15,c1f4 h4f2,1054,86,79,72,attackingF2F7 mate mateIn1 middlegame oneMove,https://lichess.org/5DK4vDDB#29,Mexican_Defense Mexican_Defense_Other_variations
003aS,8/8/5k1p/6p1/1R4PP/1p2KP2/8/1r6 w - - 0 43,h4h5 b3b2 b4b6 f6e5 f3f4 g5f4,2014,77,92,189,advancedPawn crushing defensiveMove endgame long rookEndgame,https://lichess.org/I7ZktFeR#85,
003cs,2r1kbnr/pp4pp/4p3/3pP1N1/3q4/1P2B3/P3Q1PP/nN3RK1 b k - 1 16,d4e5 f1f8 e8f8 e3c5 c8c5 e2e5 c5c1 g1f2,1986,86,89,59,advantage attraction discoveredAttack exposedKing middlegame sacrifice veryLong,https://lichess.org/PmRTKflq/black#32,Caro-Kann_Defense Caro-Kann_Defense_Advance_Variation
003eP,8/r1b1q2k/2p3p1/2Pp4/1P2p1n1/2B1P3/NQ6/2K4R b - - 1 36,h7g8 h1h8 g8f7 h8h7 f7e8 h7e7,1156,79,88,1755,crushing exposedKing long middlegame skewer,https://lichess.org/n9vCFmKh/black#72,
003if,8/3q1kpp/1P2p3/4Q3/5P2/4B2P/2r3PK/8 b - - 0 43,d7b7 e5h5 f7e7 e3c5 c2c5 h5c5,1664,98,53,24,advantage endgame long,https://lichess.org/mYGtlm6w/black#86,
003jH,rn3rk1/p5pp/3N4/4np1q/5Q2/1P3K2/PB1P2P1/2R4R w - - 0 25,f3f2 e5d3 f2e3 d3f4 h1h5 f4h5,1067,78,89,316,crushing fork long middlegame,https://lichess.org/3CQGofXT#49,
003jb,r3kb1r/p4ppp/b1p1p3/3q4/3Q4/4BN2/PPP2PPP/R3K2R b KQkq - 0 11,c6c5 d4a4 a6b5 a4b5,983,86,95,2585,crushing fork master middlegame short,https://lichess.org/960EzUS0/black#22,French_Defense French_Defense_Classical_Variation
003jv,1R6/1p2k2p/p2n2p1/4K3/8/6P1/P6P/8 w - - 10 37,b8h8 d6f7 e5e4 f7h8,1007,84,89,340,crushing endgame fork short,https://lichess.org/n0UvwK36#73,
003md,r1b1k2N/ppp3pp/2n5/2bp4/7q/1B4n1/PPPP1P1P/RNBQ1RK1 w q - 0 10,f1e1 g3e4 e1e4 d5e4 d1h5 h4h5 b3f7 h5f7,2134,78,84,211,crushing defensiveMove middlegame veryLong,https://lichess.org/ALtR2fxT#19,Russian_Game Russian_Game_Italian_Variation
003mh,r4k1r/1pp2p2/p2p3p/3N4/3P2q1/8/PPP5/1K2Q1NR b - - 1 23,a8e8 e1e8 f8e8 d5f6 e8e7 f6g4,1424,77,94,181,advantage attraction fork long middlegame sacrifice,https://lichess.org/HSa4keKZ/black#46,
003nQ,6rk/pp6/2n5/3ppn1p/3p4/2P2P1q/PP3QNB/R4R1K w - - 2 29,f1g1 f5g3 f2g3 g8g3,1287,87,67,31,crushing kingsideAttack master middlegame pin short,https://lichess.org/p85fiZcl#57,
003o0,r1bqk2r/pp1nbppp/3p4/1B1p4/3P1B2/8/PPP2PPP/R2QK1NR w KQkq - 2 9,g1f3 d8a5 d1d2 a5b5,1003,83,90,676,advantage fork master opening short,https://lichess.org/Ae0t9V1Z#17,Czech_Defense Czech_Defense_Other_variations
003r5,r2qr1k1/ppp2ppp/4b3/3P4/1nP2Q2/2N2N1P/PP3KP1/R4R2 w - - 1 15,d5e6 b4d3 f2g1 d3f4,1107,79,88,860,crushing fork middlegame short,https://lichess.org/JPN97v7j#29,Kings_Gambit_Accepted Kings_Gambit_Accepted_Abbazia_Defense
003wQ,2r2rk1/6pp/3Q1q2/8/3N1B2/6P1/PP1K3P/R4b2 w - - 0 24,a1f1 f6d6 f4d6 f8f1,1887,76,92,2011,advantage discoveredAttack middlegame pin short,https://lichess.org/W3wvnzlo#47,
0040n,r7/p2k1pp1/p1p1pn2/3p4/3P4/P3PQp1/1PP2P1q/2K4R w - - 0 20,h1h2 g3h2 f3h3 f6g4,1233,75,100,842,advancedPawn advantage endgame short,https://lichess.org/WIUWcrdG#39,
0042j,3r2k1/4nppp/pq1p1b2/1p2P3/2r2P2/2P1NR2/PP1Q2BP/3R2K1 b - - 0 24,d6e5 d2d8 b6d8 d1d8,438,111,91,1395,backRankMate mate mateIn2 middlegame short,https://lichess.org/DuM2FZjg/black#48,
00465,3r1Q1k/pp4pp/2p5/6q1/5R2/2P5/P1P2PPP/3rR1K1 b - - 8 27,d8f8 f4f8,594,89,100,328,backRankMate endgame mate mateIn1 oneMove queenRookEndgame,https://lichess.org/h21VtqGG/black#54,
0047P,8/1N3k2/6p1/8/2P3P1/pr6/R5K1/8 w - - 1 56,g2f1 b3b1 f1e2 b1b2 e2d1 b2a2,1769,75,86,92,crushing endgame exposedKing fork long master,https://lichess.org/Gb33KZKC#111,
0048h,4r3/p5k1/2p2R1p/2Pp4/1P1pr1P1/P6P/8/3R3K w - - 1 35,f6c6 e4e1 d1e1 e8e1 h1g2 d4d3,1163,75,98,1908,crushing endgame exposedKing long rookEndgame,https://lichess.org/dq15P00L#69,
004Ao,4qk2/1b3rR1/p7/1p2Q3/4P2P/P2P3K/2r5/3R4 w - - 5 41,g7f7 e8f7 e5h8 f8e7,1711,96,86,24,advantage endgame short,https://lichess.org/aFlzjb1K#81,
004Ax,8/8/4R1kp/p7/5rPK/8/7P/8 b - - 2 42,g6f7 e6h6 f4f6 h6h7 f7g6 h7a7,1987,77,92,592,crushing endgame exposedKing long rookEndgame,https://lichess.org/x2mMwVJD/black#84,
004BW,r1bk2r1/ppq2pQp/3bpn2/1BpnN3/5P2/1P6/PBPP2PP/RN2K2R w KQ - 3 13,e5f7 d8e7 g7g8 f6g8,1790,75,91,1744,advantage master middlegame short,https://lichess.org/EXlG6TZs#25,Sicilian_Defense Sicilian_Defense_Modern_Variations
004JD,3r4/R7/2p5/p1P2p2/1p4k1/nP6/P2KNP2/8 w - - 3 41,d2e3 a3c2,1271,79,91,2770,cornerMate endgame mate mateIn1 oneMove,https://lichess.org/6vTeEc3x#81,
004LZ,8/7R/5p2/p7/7P/2p5/3k2r1/1K2N3 w - - 3 48,e1g2 c3c2 b1a2 c2c1q h7d7 d2e2,1203,76,93,2041,advancedPawn crushing defensiveMove deflection endgame long promotion,https://lichess.org/drahwNdj#95,
004Lu,8/p1p4p/4Pk2/2PP1p1P/1r3r2/5B2/P3RK2/8 b - - 3 38,f6e7 d5d6 c7d6 c5d6 e7d6 e6e7,1152,75,99,798,advancedPawn advantage endgame exposedKing long master,https://lichess.org/WMeZuWza/black#76,
004Op,2kr2r1/1bp4n/1pq1p2p/p1P5/1P3B2/P6P/5RP1/RB2Q1K1 w - - 3 26,e1f1 d8d1 f1d1 g8g2 g1f1 g2g1 f1e2 g1d1,2274,77,92,1883,crushing deflection kingsideAttack middlegame pin sacrifice skewer veryLong,https://lichess.org/tneg9Bzk#51,
004RF,5rk1/5ppp/1p6/1qp2P1Q/3p3P/6R1/6PK/8 b - - 0 30,c5c4 g3g7 g8g7 f5f6 g7f6 h5b5,1746,78,82,53,attraction crushing discoveredAttack endgame long sacrifice,https://lichess.org/2UeWcE4h/black#60,
004Ud,r1bqk2r/p3Bppp/3p4/1ppn4/4P3/4Q3/PPP2PPP/2KR1B1R b kq - 0 11,d5e7 f1b5 c8d7 d1d6 d7b5 d6d8,1617,76,94,3212,advantage interference long middlegame,https://lichess.org/pJ7nXTvE/black#22,Three_Knights_Opening Three_Knights_Opening_Other_variations
004WZ,r6k/1b3pp1/p1q1pn1p/2p5/P1B5/1PN4Q/2P1RP1P/R4Kr1 w - - 2 26,f1g1 c6h1,891,81,93,108,mate mateIn1 middlegame oneMove,https://lichess.org/BQIdXPOM#51,
004X6,1r4k1/p4ppp/2Q5/3pq3/8/P6P/2PR1PP1/Rr4K1 w - - 1 26,a1b1 b8b1 d2d1 b1d1,1152,266,83,14,endgame mate mateIn2 short,https://lichess.org/wvPFkjF9#51,
004XI,8/3kqp2/4p3/p2p4/3P1P2/4P1rP/7r/1QR2K2 b - - 1 34,e7a3 b1b7 d7e8 c1c8,982,90,70,35,endgame mate mateIn2 short,https://lichess.org/54fnArpo/black#68,
004Ys,r4rk1/3q1pbp/p1n1p1p1/2p3NP/1p3B2/3P3Q/PPP3P1/R3R1K1 b - - 2 19,d7d4 f4e3 d4f6 e1f1 f6e5 h5g6 e5e3 h3e3,2299,82,90,429,advantage defensiveMove middlegame veryLong,https://lichess.org/LcIJdugn/black#38,Sicilian_Defense Sicilian_Defense_McDonnell_Attack
004b0,5kB1/4b3/4P3/2p2P2/2b5/8/p7/B6K w - - 4 48,g8f7 e7g5 f5f6 g5e3 a1e5 e3f4 e5f4 a2a1q,2368,109,47,35,advancedPawn bishopEndgame crushing deflection endgame promotion quietMove veryLong,https://lichess.org/CJKIi1QJ#95,
004d8,8/4kr2/R2p4/1p1Pp1p1/5p2/3K1P2/PPP5/8 b - - 0 39,g5g4 a6a7 e7f6 a7f7 f6f7 f3g4,1608,78,87,103,crushing endgame long rookEndgame,https://lichess.org/FrR3BHbW/black#78,
004iZ,r2r2k1/2q1bpp1/3p1n1p/1ppN4/1P1BP3/P5Q1/4RPPP/R5K1 b - - 1 20,f6d5 g3g7,469,105,89,998,kingsideAttack mate mateIn1 middlegame oneMove,https://lichess.org/dQ85JUe1/black#40,
004kB,4rr1k/pQpn2pp/3p1q2/8/8/2P5/PP3PPP/RN3RK1 w - - 1 16,b7c7 f6f2 f1f2 e8e1 f2f1 e1f1,1209,76,60,194,kingsideAttack long mate mateIn3 middlegame sacrifice,https://lichess.org/Cl9T6bjt#31,Ruy_Lopez Ruy_Lopez_Steinitz_Defense
004mT,5Q2/8/1b1kp1p1/5p2/3p4/5qPK/7P/8 b - - 1 51,d6c6 f8a8 c6d6 a8f3,1287,75,98,7378,advantage endgame short skewer,https://lichess.org/Jqhi4ozb/black#102,
004nd,3q2k1/2r5/pp3p1Q/2b1n3/P3N3/2P5/1P4PP/R6K b - - 0 24,c7d7 e4f6 d8f6 h6f6,898,75,83,209,crushing fork middlegame short,https://lichess.org/IajkZZBp/black#48,
004sY,8/2k3n1/3p2p1/1KpP2Pp/2P4P/7B/8/8 w - - 0 57,b5a6 c7d8 a6b5 g7f5,2191,95,68,32,crushing endgame short,https://lichess.org/sMrTPfXp#113,
004sg,6k1/p3b2p/1p1pP3/2p3P1/1Pnp3B/P6P/3Q3K/8 w - - 0 38,b4c5 c4d2 c5c6 d6d5 g5g6 e7d6,2394,75,90,1338,advantage clearance endgame hangingPiece long quietMove,https://lichess.org/pSRIvt7K#75,
004u0,6k1/ppq3pp/2p1rp2/4r3/4p1Q1/P5RP/1P3PP1/3R2K1 b - - 3 34,e6e8 d1d7 c7d7 g4d7,1386,75,91,1025,advantage endgame short,https://lichess.org/3gEqoQeQ/black#68,
004zI,2q3k1/4br1p/6RQ/1p1n2p1/7P/1P4P1/1B2PP2/6K1 b - - 0 27,h7g6 h6h8,1451,78,88,342,endgame mate mateIn1 oneMove,https://lichess.org/HE33gdt4/black#54,
004zh,4b1k1/4Pr2/3R2pp/1ppBP1q1/8/PP4P1/2P4P/3R3K b - - 2 38,g5h5 d1f1 g8g7 d5f7 e8f7 d6d8 h5e5 f1f7 g7f7 e7e8q e5e8 d8e8,2624,95,70,116,advancedPawn attraction crushing endgame exposedKing intermezzo pin promotion quietMove veryLong,https://lichess.org/sYeKSrqj/black#76,
0050w,5rk1/1p2p1rp/p2p4/2pPb2R/2P1P3/1P1BKP1R/8/8 b - - 4 30,g7g3 h3g3 e5g3 h5g5 g8f7 g5g3,1066,81,90,1501,crushing endgame fork long,https://lichess.org/QD8pUcTR/black#60,
0054a,r1b2rk1/ppq2ppp/8/4b2Q/4R3/3B4/PP3PPP/R1B3K1 b - - 1 15,g7g6 h5e5 c7e5 e4e5,1484,75,96,5279,advantage middlegame short,https://lichess.org/kZlE1pvD/black#30,Queens_Pawn_Game Queens_Pawn_Game_Colle_System
0055Y,r1b2rk1/p3pp2/2B4b/2Qpq3/3N2pp/4P3/2P2PPP/1R2K2R b K - 1 23,h6e3 f2e3 e5e3 e1d1,2041,76,80,148,advantage defensiveMove middlegame short,https://lichess.org/7Jpwzowt/black#46,
005Bm,4rk2/p1q5/1p3Q1b/8/1p5N/2P1p3/P3P3/2K5 b - - 0 43,c7f7 h4g6 f8g8 f6h8,1229,75,96,3890,endgame mate mateIn2 pin short,https://lichess.org/KKslCMev/black#86,
005Ep,5kr1/ppR3p1/3R3p/8/1r1n4/8/1P3PPP/2K5 b - - 4 31,d4b5 d6d8,950,77,100,182,endgame mate mateIn1 oneMove,https://lichess.org/ttFEoJfQ/black#62,
005HG,r2q1rk1/p1p2pp1/3bbn1p/4N3/2Q5/1P4P1/PB1PPP1P/RN2K2R w KQ - 1 12,c4c2 d6e5 b2e5 d8d5 f2f3 d5e5,1744,74,96,557,advantage clearance fork long opening,https://lichess.org/JTymzeq9#23,English_Opening English_Opening_Kings_English_Variation
005N7,r6k/2q3pp/8/2p1n3/R1Qp4/7P/2PB1PP1/6K1 b - - 0 32,e5c4 a4a8 c7b8 a8b8,666,100,95,1895,backRankMate endgame hangingPiece mate mateIn2 short,https://lichess.org/jxZhmGhg/black#64,
005YM,5k2/p4pp1/1qn3r1/3pP2p/5P2/1NPQ4/Pr3RPP/R5K1 w - - 5 24,b3d4 b2f2 g1f2 c6d4 d3d4 b6b2,2413,101,90,253,advantage long middlegame,https://lichess.org/fDmK2ipV#47,
005YX,2rr4/2N2pk1/p1Q1b1pp/1p4q1/3pP3/1B1P4/PPP3PP/6RK w - - 7 25,c7e6 f7e6 c6b7 g7h8,1823,162,100,29,defensiveMove equality middlegame short,https://lichess.org/zbi5w5Qy#49,
005do,7r/pp1k4/4p1b1/3pP1Np/3P1P1K/8/P7/2R5 b - - 7 42,h8f8 c1c7 d7c7 g5e6 c7b6 e6f8,1439,98,60,47,attraction crushing deflection endgame fork long sacrifice,https://lichess.org/Q1hPi58C/black#84,
005f3,r5k1/2p1pp2/pp4p1/1q1r4/5P2/2QP2R1/PP6/1K4R1 b - - 0 32,d5h5 g3g6 f7g6 g1g6 g8f7 c3g7 f7e8 g7g8 e8d7 g8e6 d7d8 g6g8,1902,73,95,14106,crushing endgame sacrifice veryLong,https://lichess.org/Prb24UzR/black#64,
005jJ,r1b1qrk1/pp1n1pbp/2pp1np1/4p3/2PP1B2/2NBPN1P/PP3PP1/R2Q1RK1 w - - 0 10,d4e5 d6e5 f4h2 e5e4,1215,82,70,36,advantage opening short,https://lichess.org/wt6Q2xGb#19,Queens_Pawn_Game Queens_Pawn_Game_Other_variations
005jR,8/5p1k/1P4pp/3Qn3/4BP2/6P1/1p2P2P/2q3K1 w - - 1 34,g1f2 b2b1q e4b1 e5g4 f2f3 c1h1,2779,97,91,182,advancedPawn crushing endgame long promotion,https://lichess.org/ltr8kYV9#67,
005nD,3rk2r/2qn1pp1/p1Q1R3/3n3p/8/8/PP4PP/5R1K b k - 0 23,f7e6 c6e6 d5e7 e6f7,1028,79,97,1156,fork mate mateIn2 middlegame short,https://lichess.org/hlgaj6lV/black#46,
005qG,8/8/1p1k1p1p/3npp2/2B5/PP1K1PP1/7P/8 b - - 0 36,f5f4 c4d5 f4g3 h2g3 d6d5 g3g4,2310,85,65,55,crushing defensiveMove endgame long,https://lichess.org/RMj9gStA/black#72,
