PuzzleId,FEN,Moves,Rating,RatingDeviation,Popularity,NbPlays,Themes,GameUrl,OpeningTags
01Aty,2kr3r/1pp2p2/p2p3p/3P1bpB/2P2P2/1P2q3/P5PP/R2QR2K b - - 3 18,e3f4 e1f1 f4e5 f1f5 e5f5 h5g4 f5g4 d1g4,1766,74,91,138,advantage middlegame pin sacrifice veryLong,https://lichess.org/DjgDrbsP/black#36,English_Opening English_Opening_Kings_English_Variation
01AwS,8/7p/2PQ4/7k/P3r1r1/1P2nK2/8/8 b - - 8 52,g4f4 d6f4 e4f4 f3f4 e3d5 f4e5,1164,76,98,900,crushing endgame long,https://lichess.org/goZSQL0z/black#104,
01AxK,3r4/2kr2qp/pp1pRNp1/n1pP1n2/P1P5/7Q/2P2PPP/4R1K1 b - - 10 26,d7e7 h3f5 g6f5 e6e7 g7e7 e1e7,1994,87,85,174,advantage fork long middlegame,https://lichess.org/QH4PNif5/black#52,
01AyE,8/4k3/ppp2pKp/4p2P/PPP5/3P4/8/8 b - - 2 38,e7e6 g6h6 e6f7 b4b5 a6b5 c4b5 c6c5 a4a5,2486,87,100,38,crushing endgame pawnEndgame veryLong,https://lichess.org/oT5KavrO/black#76,
01Az7,r1bq1rk1/pp1p1ppp/2n1pn2/4P3/2B5/2B5/PPP2PPP/R2QK1NR b KQ - 0 9,c6e5 c3e5 d8a5 e5c3,1400,87,86,50,advantage hangingPiece opening short,https://lichess.org/nMfMTSlO/black#18,Sicilian_Defense Sicilian_Defense_Bowdler_Attack
01B3g,r2q1rk1/pp1b1pb1/2n1p3/3n2NP/3P4/3QB3/PP2BPP1/2KR3R b - - 2 18,d5e3 d3h7,667,85,78,154,mate mateIn1 middlegame oneMove,https://lichess.org/9lxz1ugK/black#36,Sicilian_Defense Sicilian_Defense_Alapin_Variation
01B5q,r4rk1/1pp1np1p/p4Qp1/3P3P/P2Nq3/8/1B4R1/5B1K b - - 0 36,e7d5 f6g7 g8g7 d4f5 g7g8 f5h6,2176,73,94,9166,attraction doubleCheck long mate mateIn3 middlegame pin sacrifice,https://lichess.org/seEUcuvw/black#72,
01B6x,6k1/1B2ppbp/p2p2p1/3P4/1P2P3/P3B3/4qPPP/1Q1b2K1 w - - 1 28,g2g3 e2e1 g1g2 d1f3 g2f3 e1b1,1229,78,93,70,crushing discoveredAttack endgame long,https://lichess.org/30lJXHnJ#55,
01B8l,5k2/3Pb3/8/pK6/4R3/1Bp4p/P5r1/8 b - - 6 52,c3c2 e4f4 f8g7 f4f7,1345,76,91,5882,advantage endgame short,https://lichess.org/v2atqYUk/black#104,
01BDV,4r3/2p2p1k/3p3p/3PqP2/1p5P/1P1R4/r1P3Q1/1K4R1 w - - 0 29,b1a2 e8a8 a2b1 e5a1,979,76,83,109,endgame mate mateIn2 short,https://lichess.org/VfhRAYDX#57,
01BDz,6k1/pp6/6p1/5pN1/b1r5/7P/3R2P1/7K b - - 1 37,c4c7 d2d8 g8g7 g5e6 g7f6 e6c7,1044,76,98,486,advantage endgame exposedKing fork long,https://lichess.org/NoSKLr2U/black#74,
01BG7,r4nk1/2q2p1p/6p1/1p4Q1/p1pPp1N1/2P3R1/6PP/6K1 b - - 1 25,a4a3 g4h6 g8g7 h6f5,2228,94,90,1486,advantage endgame master pin short,https://lichess.org/Hyjuq9Hr/black#50,
01BI2,3R4/2p1k3/4p1p1/1p2P2p/1P6/8/4rr2/3R2K1 b - - 7 41,e7f7 d1d7,1042,80,94,156,endgame mate mateIn1 oneMove rookEndgame,https://lichess.org/FFtkhBNX/black#82,
01BKZ,2kr1bnr/ppp2ppp/8/8/8/q4N2/bPPBPPPP/2KR1B1R w - - 0 11,b2a3 f8a3,732,93,95,962,mate mateIn1 middlegame oneMove queensideAttack,https://lichess.org/MLJUlMpw#21,Englund_Gambit Englund_Gambit_Other_variations
01BNN,1r4k1/3R1pbp/1p2p1p1/p1q5/P1P5/1B3Q2/5PPP/6K1 b - - 0 24,c5a3 f3f7 g8h8 f7g7,955,85,87,37,endgame mate mateIn2 short,https://lichess.org/8LHFibnx/black#48,
01BRf,8/p7/1p3Nnp/1B4p1/1P4P1/P3p1bP/2k1K3/8 b - - 1 42,g3f4 b5d3 c2b3 d3g6,1076,81,95,1211,advantage endgame fork short,https://lichess.org/3av5uIrJ/black#84,
01BT1,r1bq1rk1/pp2bppp/4p3/3pn2N/1P1Q4/2P5/PB2BPPP/R4RK1 b - - 5 16,e5c6 d4g7,1083,108,69,26,kingsideAttack mate mateIn1 middlegame oneMove,https://lichess.org/njWp1YY9/black#32,Sicilian_Defense Sicilian_Defense_Modern_Variations
01BTS,2rqrk2/pb3ppB/1pn1pB1p/4N3/2PP1P2/8/P1Q3PP/2KR3R b - - 0 18,d8f6 e5d7 f8e7 d7f6,967,79,89,71,advantage fork middlegame short,https://lichess.org/KyySoA7o/black#36,Scandinavian_Defense Scandinavian_Defense_Mieses-Kotroc_Variation
01BTT,8/7p/6pP/pp1k1p2/3P1P2/PP2K3/8/8 b - - 0 49,b5b4 a3b4 a5b4 e3d3 d5e6 d3c4,1064,77,90,162,crushing endgame long pawnEndgame zugzwang,https://lichess.org/T48vjGVD/black#98,
01BUa,2kr4/pp3Rp1/2p1p1P1/4P3/4p3/2P5/PP6/1K6 w - - 0 28,f7g7 e4e3 g7h7 e3e2 h7h1 d8d1,1543,74,96,11116,advancedPawn crushing endgame long rookEndgame,https://lichess.org/yFWOkPXm#55,
01BWS,5k2/p7/6RN/6K1/1pq5/8/P7/8 b - - 12 54,c4f1 g6f6 f1f6 g5f6 a7a5 h6f5 b4b3 a2b3,1641,78,94,1036,crushing endgame fork quietMove veryLong,https://lichess.org/1kSKoOLt/black#108,
01Baj,r1b1r1k1/ppp2ppp/2n5/8/2P1q3/P4N1P/1P1QBPP1/R3K2R w KQ - 2 15,e1c1 e4e2 d2e2 e8e2,1335,79,93,5702,advantage middlegame short,https://lichess.org/SV0DvAns#29,Four_Knights_Game Four_Knights_Game_Other_variations
01Bcd,4r1r1/pp1kRp1p/2n2p2/2pN3q/2P3bN/1P4P1/P2P1P1P/R3Q1K1 b - - 0 18,c6e7 d5f6 d7d8 f6h5,1211,79,82,194,crushing fork middlegame short,https://lichess.org/hwAyyLKW/black#36,Sicilian_Defense Sicilian_Defense_Kramnik_Variation
01BeL,8/5Q1R/pr5p/6p1/5p1k/q6P/2P2PPK/8 w - - 6 39,f7g7 a3g3 f2g3 f4g3 h2g1 b6b1,1658,75,96,6986,endgame long mate mateIn3 sacrifice,https://lichess.org/jye6zZRK#77,
01BjV,1r6/8/3bkN2/2p5/P2pp3/3P3P/R4PP1/6K1 w - - 2 47,f6e4 b8b1,685,102,96,803,endgame mate mateIn1 oneMove,https://lichess.org/0vctqXhL#93,
01Bmi,rn1qk2r/ppp2ppp/5b2/3P4/4P3/5b1P/PPP1QPP1/RN2KB1R w KQkq - 0 10,e2f3 f6b2 f3b3 b2a1,1068,79,91,846,advantage middlegame short trappedPiece,https://lichess.org/cUrVP72f#19,Elephant_Gambit Elephant_Gambit_Paulsen_Countergambit
01BnQ,r1b1kb1r/pp1n1ppp/R3p3/1NppP1B1/3P4/3B1N2/1qP2PPP/3QK2R b Kkq - 0 11,b7a6 b5c7,1098,75,100,135,mate mateIn1 middlegame oneMove,https://lichess.org/Bb1uHbTP/black#22,Alekhine_Defense Alekhine_Defense_Scandinavian_Variation
01BrE,3r3r/Qbk5/1p1p3p/1P1qpp2/6p1/2P2NP1/3N1PP1/R4RK1 w - - 1 25,a1a6 d5b5 a6a4 d8a8 a4c4 b5c4 a7b7 c7b7,2148,81,77,68,advantage middlegame trappedPiece veryLong,https://lichess.org/gOM7Eh5H#49,
01Brx,5rk1/p1r3b1/1p1pR3/3b1n1q/3PNp2/2P2N2/PP2BPQP/R6K w - - 5 23,e4f6 f8f6 e6f6 f5h4 f3h4 d5g2 h4g2 h5e2,2384,94,89,809,advantage kingsideAttack middlegame sacrifice veryLong,https://lichess.org/Nvg7dPRn#45,
01Btz,2r1k2r/1p2bppp/1q1p4/p2Pp1P1/5n1P/1N3P2/PPPQ4/2KR1B1R w k - 0 17,a2a4 b6b3 f1b5 e8f8,1453,73,95,31677,advantage defensiveMove middlegame pin short,https://lichess.org/FMeNuY7a#33,Sicilian_Defense Sicilian_Defense_Najdorf_Variation
01Bxs,r2q1rk1/3b1pbp/pppQ4/2B2P2/6n1/1BN5/PPP3PP/R4RK1 w - - 0 17,c5d4 d8b8 b3f7 f8f7 d6b8 a8b8,2570,85,93,541,advantage long middlegame,https://lichess.org/SklnG4s1#33,Scotch_Game Scotch_Game_Other_variations
01BzR,5r2/3bppk1/3p1b2/2pPP2Q/7P/4q1P1/2B4K/1R6 b - - 1 33,f6e5 h5h7 g7f6 b1f1 e5f4 f1f4 e3f4 g3f4,1386,77,89,486,crushing middlegame veryLong,https://lichess.org/wKJ6dIZ0/black#66,
01C5B,1r4k1/2pRrppp/1pP5/pQ6/8/q7/5PPP/3R2K1 b - - 3 28,e7d7 c6d7 a3e7 g1f1,2534,107,90,1003,advancedPawn advantage defensiveMove endgame short,https://lichess.org/JLP9v3nU/black#56,
01C8M,r1b2rk1/p3n1b1/6pp/q2np3/2RpNPPP/3Q3N/1PPB4/3B1RK1 b - - 3 22,a5b5 c4c8 b5d3 c8f8 a8f8 c2d3,1738,77,90,1110,crushing exposedKing long middlegame,https://lichess.org/Nj8tFFC7/black#44,
01CA6,2Rr1q1k/pp1P2pp/5p2/8/8/7P/P4P1K/2R5 b - - 8 29,h8g8 c8d8 f8d8 c1c8 g8f8 c8d8,813,100,93,163,endgame,https://lichess.org/RndsMTnV/black#58,
01CAb,8/p2Q1p2/1p3p1p/2b1k3/5P2/8/PPBr1q1P/R6K b - - 0 31,e5f4 d7f5 f4e3 f5e4,1450,74,86,742,endgame mate mateIn2 short,https://lichess.org/SyXXN7Qn/black#62,
01CCG,3r1rk1/p1p1R1pp/1pq5/8/2PP4/PN4Pb/1P1Q1P1P/4R1K1 w - - 1 27,d2g5 c6g2,1017,170,67,12,mate mateIn1 middlegame oneMove,https://lichess.org/qh9NVBQS#53,
01CGR,r7/pppkq3/3b2Q1/8/5B2/8/PPn3PP/3R3K b - - 0 22,a8f8 f4d6 c7d6 g6c2,1769,76,92,949,advantage middlegame short,https://lichess.org/yWAfHEnH/black#44,
01CKc,2rq1rk1/1b3ppp/p2pp3/bp1n4/3PQ1N1/PP1B4/1BP2PPP/R4RK1 b - - 3 17,d8h4 g4f6 d5f6 e4h4,1234,78,94,16489,crushing discoveredAttack middlegame short,https://lichess.org/Krj1ThVv/black#34,Indian_Defense Indian_Defense_Other_variations
01CQ7,1n3r1k/p5pp/8/7Q/4P3/2NP4/PPPB2qP/R2KRr2 w - - 3 21,d2e3 f1e1 d1e1 f8f1,1447,76,94,1563,attraction mate mateIn2 middlegame short,https://lichess.org/yu8CZvqe#41,
01Cb9,4r2k/p3q1p1/7p/1Rp5/2PpN3/6P1/4Q2P/6K1 w - - 1 39,b5c5 e7c5 e4c5 e8e2,1730,76,84,45,crushing discoveredAttack endgame master short,https://lichess.org/Xem3uRi6#77,
01Cdm,3b2rk/p3q2p/1r3p1P/2p1nP2/2P1R2Q/1P1P4/P5P1/B4RK1 w - - 0 33,e4e5 f6e5 h4e7 d8e7 a1e5 e7f6,1484,75,94,2070,crushing long middlegame,https://lichess.org/X7xjurhE#65,
01Cds,8/p4k2/b2P4/3N2p1/4p3/2K4P/8/8 b - - 1 45,a6b7 d6d7 b7d5 d7d8q,928,75,89,232,advancedPawn crushing endgame promotion short,https://lichess.org/pKBfo6hS/black#90,
01CgO,5rk1/pp5b/4p2B/1P1p3Q/3P4/2q4P/P4PP1/6K1 b - - 0 29,f8f7 h5g5 h7g6 g5g6,1064,77,87,152,crushing endgame short,https://lichess.org/ZU8eARhP/black#58,
01CmR,5r1k/2p3p1/p1pp3p/8/Pb1PP3/1Q3P2/1P2RK1q/R1B5 w - - 3 25,f2e3 f8f3 e3f3 h2h3 f3f2 h3b3,2305,78,86,182,advantage attraction long middlegame sacrifice skewer,https://lichess.org/iNxnHQeK#49,
01Cq8,r2r1k2/5p1p/p4p2/1pP1p3/3Nb3/P3P3/1P3PPP/2RR2K1 w - - 0 20,d4b3 d8d1 c1d1 e4c2 d1d6 c2b3,1230,80,100,53,advantage endgame fork long master,https://lichess.org/0jcejOU1#39,
01Cqi,r3q1r1/1ppn3k/p2p3b/3Pp1Bp/1PP1N2P/5P1Q/P7/2K2RR1 w - - 9 27,e4f6 d7f6 g5h6 h7h6,1499,75,81,114,advantage middlegame pin short,https://lichess.org/WgxjfKN2#53,
01Cry,3r2k1/1pq2pbp/3r2p1/1QnB4/8/4P2P/PP3PP1/1RBR2K1 w - - 3 24,b5c4 b7b5 c4c2 d6d5 d1d5 d8d5,1915,75,91,429,advantage long middlegame,https://lichess.org/lpZHNbz6#47,
01CvP,1k6/pp5P/2p5/8/5P1b/2P4q/PP6/3R1RK1 b - - 4 38,h4g3 d1d8 b8c7 h7h8q g3h2 g1f2,2278,81,81,94,advancedPawn crushing endgame long master promotion,https://lichess.org/qsnoCVqZ/black#76,
01CvZ,2b5/8/6p1/1R6/3kP3/5PPn/8/3K4 w - - 1 54,d1e2 c8a6 e2d2 a6b5,1232,77,73,97,crushing endgame pin short,https://lichess.org/kmi7b3M1#107,
01CxB,4k3/R5R1/5pKp/1Pp3r1/8/6P1/4p2P/8 w - - 3 53,g6f6 g5g7 f6g7 e2e1q,1437,74,95,19920,advancedPawn crushing endgame master promotion rookEndgame short,https://lichess.org/RKxc3BDJ#105,
01D1x,r3q2k/7p/p3p1BQ/1p2P3/P7/2p2b2/1P3P1K/6R1 b - - 0 31,e8f8 h6h7,994,83,95,260,endgame mate mateIn1 oneMove,https://lichess.org/c7vivmqC/black#62,
01D3S,6k1/pp4pp/r2P4/5q2/2PR4/B2RK1Pb/P6P/8 b - - 3 32,h3g2 d6d7 a6e6 e3d2 f5a5 d2c2,2547,98,89,138,advancedPawn advantage defensiveMove endgame long,https://lichess.org/XNZkP9zx/black#64,
01D3U,3r2k1/4qp1n/2p1b1rR/p3Q1P1/2P1P2P/P3P3/1PK5/6R1 b - - 4 33,d8d3 c2d3 e6c4 d3d4,2281,84,87,35,crushing middlegame short,https://lichess.org/KWPh6yLP/black#66,
01DBx,3r2k1/1q4pp/p2p2P1/1pp5/6Q1/2P5/PP1r2PP/1R2R2K b - - 0 25,h7g6 g4g5 b7g2 g5g2 d2g2 h1g2,2065,102,79,46,crushing endgame fork long,https://lichess.org/ECqMqbgq/black#50,
01DDB,3r2k1/3r1ppp/b4p2/1N4q1/Pp6/3nRB2/4QPPP/1R4K1 b - - 5 28,d3f4 e3e8 d8e8 e2e8,613,89,100,79,kingsideAttack mate mateIn2 middlegame short,https://lichess.org/2EVt2r6r/black#56,
01DHd,r1bq1rk1/pp1nb1pp/4pp2/3pP2Q/2pP4/2P1P3/PPBN2PP/R1B2RK1 b - - 1 12,g7g6 c2g6 h7g6 h5g6,1125,74,95,4300,crushing kingsideAttack opening short,https://lichess.org/tYOhhfGL/black#24,Queens_Pawn_Game Queens_Pawn_Game_Other_variations
01DJq,4R3/6p1/5bk1/N6p/8/1P6/6PP/3r1K2 w - - 1 45,e8e1 d1e1 f1e1 f6c3 e1d1 c3a5,1000,99,95,1331,attraction crushing endgame fork long,https://lichess.org/OAuPLlZG#89,
01DKG,8/7p/p7/P1K2p1k/3B1P2/6P1/p3b2P/8 w - - 6 45,c5b4 h5g4 b4a3 g4h3,2230,83,90,328,bishopEndgame crushing endgame master short,https://lichess.org/tbE3egW7#89,
01DLY,r5n1/1p3r1k/p5pp/4Q3/3P4/1N5P/PP4PK/R1B2q2 b - - 0 24,a8f8 c1h6 f1a1 b3a1,1730,92,85,51,crushing middlegame short,https://lichess.org/FctQbNac/black#48,
01DM2,6k1/5p2/1p2pn2/3pN3/1P1P1Pp1/P3r1Pp/2q1RP1P/6K1 w - - 0 32,e2c2 e3e1,431,108,92,708,endgame mate mateIn1 oneMove,https://lichess.org/eW07IKXH#63,
01DT3,8/6bp/6p1/Nkp5/1p6/1Pn3P1/P4P1P/B5K1 w - - 1 28,a1c3 b4c3 a5c4 b5b4 c4e3 b4a3,2209,75,94,2988,crushing endgame long,https://lichess.org/uBA5k1uv#55,
01DVo,3q2k1/1p2brp1/1nn1p2p/p1p1P2N/P1Pp3P/1P1P2Q1/1B3P2/4RBK1 w - - 7 31,f1h3 e7h4 h3e6 h4g3,1095,77,100,66,advantage middlegame short,https://lichess.org/Mm3OAzt5#61,
01DXj,8/pR6/8/P7/2Pb1rk1/1P1K4/8/8 b - - 0 39,d4g1 b7g7 g4f5 g7g1,824,81,97,188,advantage endgame master short skewer,https://lichess.org/kyzVQnHB/black#78,
01Dcf,1k4r1/3p1p2/1Bn4p/5q2/5P2/1Q4P1/P7/R5K1 w - - 2 29,a1b1 g8g3 b3g3 f5b1,1258,79,92,779,crushing deflection endgame short,https://lichess.org/x6stMH1k#57,
01DhL,1r4k1/2q3p1/p3R2p/b2p4/1rpP3N/6P1/1PQ1RPP1/6K1 b - - 0 31,b4b2 e6e8 b8e8 e2e8 g8f7 c2g6,1490,76,97,9654,killBoxMate long mate mateIn3 middlegame,https://lichess.org/pT896h9l/black#62,
01Dm4,3r2k1/pp2pp2/3p2pq/5P2/4P3/2P2N2/P1PK1QnP/6R1 w - - 5 28,d2e2 g2f4 e2d1 f4h3,1169,76,87,1742,crushing endgame short,https://lichess.org/nQB6Phy7#55,
01Dmj,k2r4/pb1q1pp1/2n1p1n1/3pP3/2N3P1/1QP2N2/PP3P2/2KR3B w - - 8 20,h1g2 d5c4 d1d7 c4b3 d7d8 c6d8,1581,77,94,616,advantage long middlegame,https://lichess.org/Sjj9B0gl#39,
01Dor,8/3k2P1/3Pb3/p1q2p2/1p6/1P4r1/P1P1Q3/1K1R4 w - - 1 39,e2e6 d7e6 d6d7 g3g2 g7g8b g2g8,2192,76,91,2911,crushing endgame hangingPiece long master,https://lichess.org/0MUqBgJG#77,
01Dq7,2k5/ppp3q1/4p1r1/4P3/3P4/1PP2RPp/P3Q1nP/5K2 b - - 2 30,g7h7 f3f8 c8d7 e2b5 c7c6 b5b7,1053,79,94,988,endgame long mate mateIn3 queensideAttack,https://lichess.org/4SXAZbeY/black#60,
01Dsa,8/7Q/2kp4/4p3/5r1P/3P2K1/6P1/6b1 w - - 5 46,h4h5 g1f2 g3h3 f4h4,1018,75,88,228,endgame mate mateIn2 short,https://lichess.org/bgWBphZU#91,
01Dsr,7k/rB2n1pp/5q2/1Q6/p6P/6P1/6PK/8 b - - 1 38,a4a3 b5e8 e7g8 b7d5 f6f7 d5f7 a7f7 e8f7,1177,77,96,128,crushing endgame veryLong,https://lichess.org/v4603EHf/black#76,
01Dt6,3r2k1/1bqPn1pp/p3pp2/1pp3PQ/8/8/PPP4P/1K1R1R2 b - - 1 28,f6f5 h5e8 d8e8 d7e8q,1398,76,88,1934,advancedPawn kingsideAttack mate mateIn2 middlegame promotion short,https://lichess.org/rCyfbn1Z/black#56,
01Dtr,b4rk1/2pn2p1/1p4q1/6N1/7Q/4B3/1P3PPP/3R2K1 w - - 6 27,d1d7 g6b1 e3c1 b1c1 d7d1 c1d1,740,95,95,1170,long mate mateIn3 middlegame,https://lichess.org/ZvCTnCI7#53,
01DwE,6k1/5pb1/p1p1p1pp/P1Bq4/2bP1Q2/1rP1RN1P/5PP1/6K1 b - - 0 23,d5f5 f4f5 g6f5 f3d2 f5f4 e3f3,2242,86,91,1434,advantage clearance fork long middlegame,https://lichess.org/pOyJVJho/black#46,
01E0R,1r1q3k/4B1p1/b1r2n1p/4RB2/P1pPp3/1pQ1P3/6PP/1R4K1 b - - 1 40,d8b6 d4d5 f6d5 e5d5,2010,78,77,60,crushing middlegame short,https://lichess.org/SMp2VxOa/black#80,
01E12,2k5/1pp1r1bQ/pr2p3/3p1p2/q2P4/P2NP3/1PP3PP/K3RR2 b - - 0 25,g7d4 h7e7 d4b2 d3b2,2068,80,92,1389,crushing hangingPiece middlegame short,https://lichess.org/H8ePJ8ba/black#50,
01E5s,r1b1kbnr/p1ppqppp/8/1p2P3/1n1Q4/5N2/PPP1PPPP/RNB1KB1R w KQkq - 4 8,d4e4 d7d5 e4f4 b4c2,1807,101,79,29,advantage opening short,https://lichess.org/jBa71LkS#15,Englund_Gambit_Complex Englund_Gambit_Complex_Stockholm_Variation
01EB4,7k/6p1/2p4p/p3P3/P7/1P1Bq2P/2P3P1/5R1K b - - 0 32,e3e5 f1f8,437,91,55,102,endgame master mate mateIn1 oneMove,https://lichess.org/fNOT9tE8/black#64,
01EDR,8/8/8/p4R1p/2p1k3/P4R1P/1P2q1P1/7K w - - 4 38,f5a5 e2e1 h1h2 e1a5,1177,75,95,646,endgame,https://lichess.org/W89MP6kG#75,
01EEp,5r1k/2p3p1/7p/p4N2/Pb1B1n2/3B1b2/1PP4P/R5K1 b - - 0 23,f4d3 d4g7 h8h7 g7f8 b4f8 c2d3,1423,74,94,12539,crushing fork long middlegame,https://lichess.org/AKTT9Ch7/black#46,
01EFz,2r2rk1/p2bbpp1/2n1pn1p/q3P1N1/3P1B1P/2PQ4/P2N1PP1/R3K2R b KQ - 0 16,f6d5 d3h7,763,86,79,79,mate mateIn1 middlegame oneMove,https://lichess.org/nIzUwces/black#32,Queens_Pawn_Game Queens_Pawn_Game_London_System
01EKU,rn1q2k1/p1pp2pB/1p2pb2/6NQ/3P4/2P5/PP3P2/R3K2b b Q - 5 20,g8f8 h5f7,929,75,91,375,mate mateIn1 middlegame oneMove,https://lichess.org/zhb0rnDg/black#40,
01EMd,r6k/4q1pp/1n1pBp2/2p1nP2/1p2R2Q/1P5P/r5P1/2B1R1K1 b - - 6 31,b6d7 h4h7 h8h7 e4h4,1322,77,94,7174,attraction kingsideAttack mate mateIn2 middlegame sacrifice short,https://lichess.org/cQMrswkE/black#62,
01EPu,r2q1rk1/pp1n1pbp/3p2p1/2pN4/Q3PB2/8/PPP2PPP/R4RK1 w - - 4 13,f4d6 d7b6 d5b6 a7b6 a4a8 d8a8,1700,76,94,1879,advantage long middlegame,https://lichess.org/Uu5kbZPv#25,Scotch_Game Scotch_Game_Lolli_Variation
01EQu,8/2n5/8/Pkp1K3/2N5/8/8/8 w - - 7 57,e5d6 b5c4 d6c7 c4b5 a5a6 b5a6,1719,76,99,280,crushing endgame knightEndgame long,https://lichess.org/PXioHcpt#113,
01ESO,1r3n2/p3p1kp/3p1n1N/1p3P1R/2r3P1/3B1P2/PPP5/1K1R4 w - - 1 27,g4g5 f6h5 d3c4 b5c4,935,79,85,489,advantage master middlegame short,https://lichess.org/0uV7SRFm#53,
01EUl,r2qk2r/ppp2pp1/2p2n2/7p/3bP1b1/2N3Q1/PPP2PPP/R1B1KB1R w KQkq - 0 9,h2h3 d4c3 g3c3 d8d1,1311,77,95,33837,clearance mate mateIn2 opening short,https://lichess.org/eR5rGPfR#17,Russian_Game Russian_Game_Stafford_Gambit
01EfV,rn2k2r/ppq2p2/2p1pp2/8/2BN2p1/3P4/PPPB1P2/R2Q1RbK w kq - 4 16,h1g1 c7h2,705,86,98,1027,mate mateIn1 middlegame oneMove,https://lichess.org/YkITVZm0#31,Scandinavian_Defense Scandinavian_Defense_Main_Line
01Egl,2k5/r5p1/2K2p1p/8/7P/p7/8/4R3 b - - 7 61,a3a2 e1e8,686,94,73,178,endgame mate mateIn1 oneMove rookEndgame,https://lichess.org/HRglcTgk/black#122,
01EiO,6k1/3n2bp/3Np1p1/1p1pP3/1PpP4/2P1PQ2/rq4PP/5R1K b - - 1 27,d7f8 d6e8 b2g2 f3g2 a2g2 h1g2,2166,93,83,30,advantage long middlegame,https://lichess.org/eW0NFRh4/black#54,
01Epj,5r2/1p2Q3/8/pk3rK1/5P2/3P3P/8/8 w - - 2 46,g5g6 f8f6 e7f6 f5f6 g6f6 a5a4 f4f5 a4a3 f6g6 a3a2 f5f6 a2a1q,1668,76,93,1201,advancedPawn crushing endgame master masterVsMaster promotion queenRookEndgame quietMove veryLong,https://lichess.org/oXYJR89c#91,
01Esj,2r5/p2bk1Q1/1p2p3/3nN3/3P4/8/Pq3PPP/4R1K1 b - - 0 25,e7d6 g7d7,1299,76,71,123,mate mateIn1 middlegame oneMove,https://lichess.org/TYiEDFul/black#50,
01Eta,3r4/5kp1/1pp5/6p1/1P1q1pN1/P3p2P/4Q1P1/5R1K w - - 2 33,f1d1 d4d1 e2d1 d8d1,410,107,90,299,crushing endgame short,https://lichess.org/TFDdFcUV#65,
01EuL,3Q4/5pk1/5P2/4K2p/P2P4/2q1p3/5r2/8 b - - 0 52,g7g6 d8g8 g6h6 g8g7,965,95,95,205,endgame mate mateIn2 short,https://lichess.org/RG5h38pt/black#104,
01F1G,r2q3k/4n1bp/bpB1Qrp1/pN3p2/P4B2/5N2/1P3PPP/R2R2K1 b - - 0 18,d8d1 a1d1 f6e6 c6a8,1594,185,100,8,crushing middlegame short,https://lichess.org/I15Vgant/black#36,Sicilian_Defense Sicilian_Defense_Smith-Morra_Gambit_Accepted
01F1N,r4rk1/pp1q2pp/3p1p2/2p1nP2/5Q2/2P4P/PP1N1PP1/4RRK1 b - - 3 17,e5d3 f4c4 d6d5 c4d3,1157,76,88,141,crushing fork middlegame short,https://lichess.org/OPiXnLpo/black#34,Philidor_Defense Philidor_Defense_Exchange_Variation
01F3z,r4rk1/pp1b1ppp/8/2bBB3/8/8/PP3PPP/R4RK1 b - - 0 16,f8e8 d5b7 e8e5 b7a8,1874,76,93,2750,advantage middlegame short,https://lichess.org/d9xyOCEM/black#32,Horwitz_Defense Horwitz_Defense_Other_variations
01F65,8/8/8/8/8/3K1p1k/5P2/8 b - - 3 63,h3h2 d3e4 h2g2 e4e3,1917,78,91,247,crushing endgame pawnEndgame short zugzwang,https://lichess.org/2vUQQCwY/black#126,
01F7L,r3kb1r/ppp2ppp/8/2p1Pb2/3Pn2q/3B1P2/PPP3PP/RNBQK2R w KQkq - 1 9,e1e2 h4f2,941,77,86,242,mate mateIn1 oneMove opening,https://lichess.org/bHxdc27g#17,Russian_Game Russian_Game_Stafford_Gambit
01FB6,5n1k/6p1/7p/8/Qb1P2N1/2q1B2P/6P1/6K1 w - - 0 31,a4e8 c3e1 g1h2 b4d6 g4e5 e1e3,1231,75,85,389,advantage deflection endgame long,https://lichess.org/StB6avH2#61,
01FCo,1k2r2r/1Pp2pb1/1n1p3p/3Pq1p1/1Q1NP3/2P2P2/P4R1P/R3K3 b Q - 0 22,g7f6 d4c6 b8b7 c6e5,997,86,96,2231,crushing fork middlegame short,https://lichess.org/ppE9yTN1/black#44,
01FHB,4k2r/r2p1pp1/p3p2p/1P2q3/Q2bP3/5B2/P2R1PPP/3R2K1 b k - 0 20,a6b5 a4d4 e5d4 d2d4,1490,76,96,1925,advantage master middlegame short,https://lichess.org/UDs8qH3o/black#40,
01FId,2rr4/1Q3p1k/6pp/p4q2/8/2P1R1R1/P4PK1/8 b - - 5 38,d8d2 e3f3 d2b2 b7b2,1966,77,94,4709,crushing endgame short,https://lichess.org/8yPoEYjy/black#76,
01FJi,3q1rk1/p4p1p/4p1p1/3rN3/1P1nRQP1/P7/5P1P/4R1K1 b - - 4 35,d8h4 e4d4 d5d4 f4d4,1367,76,93,247,advantage middlegame short,https://lichess.org/aa5AaEHa/black#70,
01FSC,4r3/5Qkp/p5pN/8/6P1/6KP/P1P1r3/8 b - - 0 34,g7h6 g4g5 h6h5 f7f3 h5g5 f3f4 g5h5 f4h4,2118,80,88,477,endgame mate mateIn4 queenRookEndgame veryLong,https://lichess.org/efFWEKnd/black#68,
01FU2,rnb1r1k1/pp3p1p/3p2pQ/3NB3/2P5/3BPN2/Pq1b2PP/3K3n b - - 1 16,e8e5 d5f6 g8h8 h6h7,1425,100,100,72,kingsideAttack mate mateIn2 middlegame short,https://lichess.org/qyKU499m/black#32,Indian_Defense Indian_Defense_Budapest_Defense
01Fbm,4r1k1/4rp1p/p2p2pP/1p1P2P1/2qb1B2/PP6/2PQ1R2/1K3R2 b - - 0 29,c4c5 f4d6 c5c3 d2c3,1797,75,94,2512,crushing master middlegame short,https://lichess.org/JBjYDUYH/black#58,
01FmQ,3r2k1/2B3pp/1Q2Pp2/2b5/P3n3/5N2/2q2PPP/5RK1 w - - 4 32,e6e7 c2f2 f1f2 d8d1 f3e1 d1e1,1806,75,96,8749,long mate mateIn3 middlegame pin sacrifice,https://lichess.org/e8I8ds3w#63,
01Fml,8/8/1p2pk1p/pP4p1/P2PpPP1/4P3/3K4/8 w - - 0 43,f4g5 f6g5 d4d5 e6d5,1491,78,87,2400,crushing endgame pawnEndgame short,https://lichess.org/tf8EObMs#85,
01FzV,8/8/6k1/5p2/2R4P/3K1n2/2p5/8 w - - 2 49,c4c2 f3e1 d3c4 e1c2,966,78,93,201,crushing endgame fork short,https://lichess.org/M4hQwWy8#97,
01G4i,6r1/1pp2rpk/p4nR1/3qpP1P/8/2P3Q1/PP3P1K/6R1 b - - 6 35,f6h5 g6h6 g7h6 g3g8,1921,76,95,2134,discoveredAttack mate mateIn2 middlegame short,https://lichess.org/z8X3byMF/black#70,
01G5k,8/b6p/P1K2k2/2p3p1/6P1/8/1P3P2/8 b - - 1 49,f6e5 c6b7 e5d6 b7a7 d6c7 b2b3 h7h6 f2f3,1960,75,99,254,bishopEndgame crushing defensiveMove endgame quietMove trappedPiece veryLong zugzwang,https://lichess.org/1wwwMKcH/black#98,
01G6K,r2r2k1/pp2bppp/2n1p3/8/2BP4/4BN1q/PP3P2/2RQ1R1K w - - 6 20,f3h2 e7d6 f2f4 h3e3,1373,74,95,33885,advantage middlegame short,https://lichess.org/tcrbi3Dc#39,
01G6T,5rk1/1p1b3p/p2pN2q/2pP2p1/2P3nP/1P4P1/P5B1/4QR1K b - - 1 30,g5h4 f1f8 h6f8 e6f8,1018,78,86,510,crushing kingsideAttack middlegame short,https://lichess.org/d4XkLc0L/black#60,
01G8m,8/6pk/1R5p/3r4/4p3/5pP1/5P1P/4R1K1 w - - 0 41,e1e4 d5d1 e4e1 d1e1,732,116,100,17,endgame mate mateIn2 rookEndgame short,https://lichess.org/Vue5hudw#81,
01GAH,2n1k3/p7/1q1b1p2/n3pP2/b2pP3/1p1P4/1P1BN3/3QNB1K b - - 1 26,b6c7 d1a1 c7d7 d2a5,1902,74,87,723,advantage master middlegame short,https://lichess.org/NwwqQHc2/black#52,
01GBu,5r1k/3p2bp/p4pp1/qp1br3/4P3/1Q4B1/PP2RPPP/4R1K1 w - - 0 23,e4d5 a5e1 e2e1 e5e1,1314,76,94,4929,backRankMate mate mateIn2 middlegame short xRayAttack,https://lichess.org/t1gBJrWV#45,
01GC2,3b4/pp2kprp/8/1Bp5/4R3/1P6/P4PPP/1K6 b - - 0 22,e7f8 e4e8,483,108,93,998,endgame mate mateIn1 oneMove,https://lichess.org/6c75Zk3T/black#44,
01GCT,5r1k/6p1/R3bn1p/8/1P6/P2PqB2/1B2P2P/6RK b - - 0 30,h8h7 f3e4 h7h8 a6e6,1273,77,85,237,advantage interference middlegame short,https://lichess.org/lC8C6VlE/black#60,
01GHp,r4r1k/ppp4p/2n5/2b5/8/6N1/PPPP2PP/R1B2RK1 w - - 7 18,g1h1 f8f1 g3f1 a8f8 f1g3 f8e8,2344,90,87,611,advantage clearance defensiveMove long middlegame,https://lichess.org/xBiZzLMA#35,Kings_Gambit Kings_Gambit_Other_variations
01GKn,2r2rk1/pbb1qp1p/1pn1p1p1/8/1P1PN3/P2BP2R/2Q1N1PP/5RK1 b - - 3 20,c6b8 e4f6 e7f6 f1f6,966,88,90,610,crushing kingsideAttack middlegame short,https://lichess.org/uBkKtvl9/black#40,
01GQI,8/5p2/1kbB2p1/4Pp1p/p2P1P2/1pR3P1/1Kn4P/8 b - - 13 58,c2d4 d6c5 b6c7 c5d4,1038,77,88,216,crushing endgame fork short,https://lichess.org/URyEHRKp/black#116,
01GXf,r3k2r/pR2bppp/4p3/3N4/8/8/P4PPP/4R1K1 b kq - 0 20,e7f6 d5c7 e8f8 c7a8,1103,82,95,2010,crushing endgame fork short,https://lichess.org/iduwCdmp/black#40,
01GYU,r5k1/p2nqppp/1p1b1n2/2p1r3/8/1BNPB2P/PPP2PP1/R2QR1K1 w - - 2 16,e3f4 e5e1 d1e1 e7e1 a1e1 d6f4,831,123,89,32,middlegame,https://lichess.org/3qIfu9yd#31,Scandinavian_Defense Scandinavian_Defense_Boehnke_Gambit
01GcH,8/KP3k2/8/5p2/8/8/1R2p3/2r5 w - - 0 56,b7b8q c1a1 a7b6 e2e1q b8c7 e1e7 c7e7 f7e7,1826,79,93,2185,advancedPawn advantage endgame master promotion queenRookEndgame veryLong,https://lichess.org/j76CnG9Q#111,
01GiU,6rk/1p3p2/1qb1pP1p/p2p2B1/P2P2Q1/2P5/7P/R4RK1 w - - 0 26,g4h5 g8g5 h5g5 h6g5,975,83,78,41,advantage fork middlegame short,https://lichess.org/rlEIa92S#51,
01Gjl,rn2k2N/p1pn3p/8/3b2B1/3p4/N7/PP4PP/4R1K1 b - - 3 21,e8f8 g5h6 f8g8 e1e8 d7f8 e8f8,1676,74,96,8223,exposedKing long mate mateIn3 middlegame,https://lichess.org/ATVeox2b/black#42,
01GkW,5b1k/pQ6/5BBp/5P2/3q2p1/7P/6PK/8 b - - 0 36,d4f6 b7h7,572,98,94,275,endgame mate mateIn1 oneMove,https://lichess.org/i07nEgsG/black#72,
01GnH,1R6/P7/6p1/7p/8/7k/K7/2q5 b - - 1 43,c1c4 b8b3 h3g4 a7a8q,1200,76,100,466,advancedPawn advantage endgame promotion queenRookEndgame short,https://lichess.org/QXjY4nyw/black#86,
01Gqt,4Q3/6bk/6pp/pp6/8/3qBP1P/PP6/K1R5 w - - 0 37,a2a3 d3a3 a1b1 a3b2,1398,74,100,1551,endgame mate mateIn2 pin short,https://lichess.org/9fYQl16d#73,
01Gvc,1k1r3r/ppp4p/3np1p1/Pb1pQ2P/3P4/2P5/1P1K1PP1/R6R w - - 1 22,h5g6 d6c4 d2c2 c4e5,1008,81,85,76,advantage fork middlegame short,https://lichess.org/CTGHtpTC#43,
01GwB,1r1b1r2/3P2pk/7p/4R3/P6P/4RpP1/5P2/6K1 b - - 3 44,b8b7 e5e8 f8g8 e8g8 h7g8 e3e8 g8f7 e8d8,1175,82,94,281,advantage attraction endgame fork veryLong,https://lichess.org/3iyCcPso/black#88,
01H0Y,r1b2rk1/p2p1pp1/1p3q1p/3Np3/1P2P3/P4P2/4Q1PP/R4R1K b - - 1 19,f6g6 d5e7 g8h7 e7g6,828,92,76,65,crushing fork middlegame short,https://lichess.org/4RkoQDEf/black#38,Sicilian_Defense Sicilian_Defense_Taimanov_Variation
01H0o,r4Bk1/5p1p/p1q3p1/1p3N2/2pPr3/2P5/5PQ1/R4K2 b - - 0 31,a8f8 f5e7 e4e7 g2c6,1439,76,100,613,advantage endgame master short,https://lichess.org/bfDCOeTo/black#62,
01H4V,r5k1/6p1/2N3pp/3p4/P2P4/1P5n/6PP/5RqK w - - 7 34,f1g1 h3f2,1062,78,100,243,endgame mate mateIn1 oneMove smotheredMate,https://lichess.org/ekvxZJSu#67,
01H66,4r3/6K1/8/5RP1/1PpP4/P1P3k1/8/4b3 w - - 5 52,f5e5 e8e5 d4e5 e1c3 g7g6 c3e5 g6f5 c4c3 f5e5 c3c2 g5g6 c2c1q,1735,76,96,2486,advancedPawn crushing endgame pin promotion veryLong,https://lichess.org/ycrq3HDe#103,
01H6V,8/RR4pk/6r1/7p/P3KP1P/4P1P1/1pr5/8 w - - 0 50,e4f3 c2c7 b7b2 c7a7,1984,75,94,1977,advantage endgame master rookEndgame short,https://lichess.org/rHuUZ772#99,
01HAa,r1bq3r/1np1k1b1/pp1p3p/3Pp2B/2P1Pp1Q/2N5/PP1N2PP/R4RK1 b - - 5 19,e7d7 h4g4 d7e7 g4g7,1905,75,86,274,fork mate mateIn2 middlegame short,https://lichess.org/duha46pd/black#38,
01HAq,rn1q1rk1/1bppppbp/1p4pn/6N1/p1B1P3/2PP3Q/PP3PPP/RNB1K2R w KQ - 0 9,c4f7 f8f7 g5f7 h6f7,1849,74,76,93,advantage opening short,https://lichess.org/jjI0oEay#17,Owen_Defense Owen_Defense_Other_variations
01HBm,r4rk1/pb2bpp1/4pn1p/2pqN3/3p3B/3P3P/PPP1NPP1/1R1Q1RK1 w - - 2 15,h4g3 d5g2,543,139,33,21,kingsideAttack mate mateIn1 middlegame oneMove,https://lichess.org/uptCqzGJ#29,Caro-Kann_Defense Caro-Kann_Defense_Other_variations
01HI3,Q3R3/1R3ppk/7p/8/2p5/2P5/1Pr4r/4K3 w - - 3 54,b7f7 c2c1,1238,81,93,1104,endgame mate mateIn1 oneMove queenRookEndgame,https://lichess.org/cBCqtthS#107,
